company_number,company_name,status,company_type,date_of_creation,address,postcode,locality,region,sic_codes,sic_descriptions,matched_sic_codes,keywords_matched
09451236,PERFORMANCE TYRES (LEEDS) LIMITED,active,ltd,2015-02-20,"3 Greengate Cardale Park, Harrogate, North Yorkshire, HG3 1GY, England",HG3 1GY,Harrogate,North Yorkshire,45320,45320: Retail trade of motor vehicle parts and accessories,45320,tyre
00986754,NATIONAL TYRE SERVICE LIMITED,active,ltd,1970-08-12,"Icknield Street Drive Icknield Street Drive, Washford West, Redditch, B98 0DE, England",B98 0DE,Redditch,,45200; 45320,45200: Maintenance and repair of motor vehicles; 45320: Retail trade of motor vehicle parts and accessories,45320,tyre
15934322,CITY TYRE S3 LTD,active,ltd,2024-09-03,"53 Burngreave Road, Sheffield, S3 9DB, England",S3 9DB,Sheffield,,45320,45320: Retail trade of motor vehicle parts and accessories,45320,tyre
15996152,VIP TYRE CENTRE LTD,active,ltd,2024-10-03,"42/52 Garrison Lane, Birmingham, B9 4BS, United Kingdom",B9 4BS,Birmingham,,45320,45320: Retail trade of motor vehicle parts and accessories,45320,tyre
13545498,DANS TYRE SERVICES LTD,active,ltd,2021-08-03,"2 Highfield Road, Ashbourne, DE6 1DX, England",DE6 1DX,Ashbourne,,45200; 45320,45200: Maintenance and repair of motor vehicles; 45320: Retail trade of motor vehicle parts and accessories,45320,tyre
05377535,EDGWICK TYRES (COVENTRY) LIMITED,active,ltd,2005-02-28,"The Dairy Buckwell Lane, Clifton Upon Dunsmore, Rugby, CV23 0BJ, England",CV23 0BJ,Rugby,,45320,45320: Retail trade of motor vehicle parts and accessories,45320,tyre
12031412,TNT TYRES INTERNATIONAL LTD,active,ltd,2019-06-04,"1st Floor, 29 Minerva Road, London, NW10 6HJ, England",NW10 6HJ,London,,45320,45320: Retail trade of motor vehicle parts and accessories,45320,tyre
14289116,SYDENHAM TYRES LIMITED,active,ltd,2022-08-10,"301 Sydenham Road, London, SE26 5EW, England",SE26 5EW,London,,45320,45320: Retail trade of motor vehicle parts and accessories,45320,tyre
15959771,MOBILE TYRE MEDICS LIMITED,active,ltd,2024-09-16,"6 Fallowfield Drive, Newport, NP19 4TD, Wales",NP19 4TD,Newport,,45320,45320: Retail trade of motor vehicle parts and accessories,45320,tyre
14584082,TROJAN TYRES LTD,active,ltd,2023-01-11,"133 Tame Road, Birmingham, B6 7DG, England",B6 7DG,Birmingham,,45310; 45320,45310: Wholesale trade of motor vehicle parts and accessories; 45320: Retail trade of motor vehicle parts and accessories,45320; 45310,tyre
07077243,GENESIS TYRES AND  ALLOYS LTD,active,ltd,2009-11-16,"Unit 4 Linthwaite Business Centre, Manchester Road, Linthwaite, Huddersfield, HD7 5QS",HD7 5QS,Huddersfield,,45320,45320: Retail trade of motor vehicle parts and accessories,45320,tyre
SC624689,DELLINGBURN TYRES GREENOCK LIMITED,active,ltd,2019-03-18,"3 Longcraigs Avenue, Ardrossan, KA22 7PU, Scotland",KA22 7PU,Ardrossan,,45320,45320: Retail trade of motor vehicle parts and accessories,45320,tyre
13660241,MOBILE TYRE SERVICES LTD,active,ltd,2021-10-04,"15 Redman Road, High Wycombe, HP12 4PH, England",HP12 4PH,High Wycombe,,45320,45320: Retail trade of motor vehicle parts and accessories,45320,tyre
06468722,HILSEA TYRES LTD,active,ltd,2008-01-09,"Unit 21, Limberline Road, Hilsea, Portsmouth, PO3 5BJ",PO3 5BJ,Hilsea,Portsmouth,45320,45320: Retail trade of motor vehicle parts and accessories,45320,tyre
09424760,ONLINE TRUCK AND TRAILER PARTS LIMITED,active,ltd,2015-02-05,"Online House, 240 Freshwater Road, Dagenham, Essex, RM8 1RX, United Kingdom",RM8 1RX,Dagenham,Essex,45320,45320: Retail trade of motor vehicle parts and accessories,45320,truck
13838842,A H TYRE DISTRIBUTION LTD,active,ltd,2022-01-10,"228 Middlewood Road, Sheffield, S6 1TE, England",S6 1TE,Sheffield,,45320,45320: Retail trade of motor vehicle parts and accessories,45320,tyre
14928479,CULVERT TYRES LTD,active,ltd,2023-06-12,"1 Mychell House, Pincott Road, Wimbledon, London, SW19 2NN, England",SW19 2NN,Wimbledon,London,45320,45320: Retail trade of motor vehicle parts and accessories,45320,tyre
15090313,A1 TYRES AND AUTO REPAIR LTD,active,ltd,2023-08-22,"111 Fengate, Unit Number 2, Peterborough, PE1 5BA, England",PE1 5BA,Peterborough,,45200; 45320,45200: Maintenance and repair of motor vehicles; 45320: Retail trade of motor vehicle parts and accessories,45320,tyre
13661527,PIT LANE TYRES LTD,active,ltd,2021-10-05,"73 Park Lane, Croydon, CR0 1JG, England",CR0 1JG,Croydon,,45320,45320: Retail trade of motor vehicle parts and accessories,45320,tyre
07897529,FASTER FIT TYRES LTD,active,ltd,2012-01-04,"17 High Street East, Scunthorpe, South Humberside, DN15 6UH",DN15 6UH,Scunthorpe,South Humberside,45320,45320: Retail trade of motor vehicle parts and accessories,45320,tyre
11783037,SCOTTY'S TYRES FINCHLEY LTD,active,ltd,2019-01-23,"207 Regents Park Road, London, N3 3LD, United Kingdom",N3 3LD,London,,45320,45320: Retail trade of motor vehicle parts and accessories,45320,tyre
16049229,TRUCK TYRES ONLINE LTD,active,ltd,2024-10-29,"Booth Street Chambers, 32 Booth Street, Ashton-Under-Lyne, Lancashire, OL6 7LQ, England",OL6 7LQ,Ashton-Under-Lyne,Lancashire,45310; 45320,45310: Wholesale trade of motor vehicle parts and accessories; 45320: Retail trade of motor vehicle parts and accessories,45320; 45310,truck; tyre
14530436,LONDON TYRES (HORNCHURCH) LTD,active,ltd,2022-12-08,"139 Hornchurch Road, Hornchurch, RM12 4SZ, England",RM12 4SZ,Hornchurch,,45320,45320: Retail trade of motor vehicle parts and accessories,45320,tyre
16053510,TYRE PLEX LIMITED,active,ltd,2024-10-31,"20 Newark Road, Luton, LU4 8LD, England",LU4 8LD,Luton,,45200; 45320,45200: Maintenance and repair of motor vehicles; 45320: Retail trade of motor vehicle parts and accessories,45320,tyre
12415798,N K TYRES LTD,active,ltd,2020-01-21,"5 Alexandra Road, London, London, E10 5QQ, United Kingdom",E10 5QQ,London,London,45200; 45320,45200: Maintenance and repair of motor vehicles; 45320: Retail trade of motor vehicle parts and accessories,45320,tyre
09010819,KEV'S TYRES LIMITED,active,ltd,2014-04-25,"114 Mount Road, Lanesfield, Wolverhampton, WV4 6NE",WV4 6NE,Wolverhampton,,45320,45320: Retail trade of motor vehicle parts and accessories,45320,tyre
16094074,A S TRUCKS LTD,active,ltd,2024-11-21,"A S Trucks Ltd, Byfield Works, Wybeck Road, Scunthorpe, South Humberside, DN15 8QR, United Kingdom",DN15 8QR,Scunthorpe,South Humberside,45320,45320: Retail trade of motor vehicle parts and accessories,45320,truck
14805299,TYRE SALES ABINGDON LIMITED,active,ltd,2023-04-15,"2 Bignell Park Barns, Chesterton, Bicester, OX26 1TD, England",OX26 1TD,Bicester,,45320,45320: Retail trade of motor vehicle parts and accessories,45320,tyre
11000260,SCOTTY'S TYRES WALTHAMSTOW LTD,active,ltd,2017-10-06,"1-2 Market Parade, 331 Forest Road, London, E17 6DY, United Kingdom",E17 6DY,London,,45320,45320: Retail trade of motor vehicle parts and accessories,45320,tyre
11879810,CHECKPOINT TYRE & AUTO (DEVIZES) LIMITED,active,ltd,2019-03-13,"Morningside, 19 The Moorlands, Devizes, Wiltshire, SN10 5HF, United Kingdom",SN10 5HF,Devizes,Wiltshire,45320,45320: Retail trade of motor vehicle parts and accessories,45320,tyre
08635979,ALDRIDGE TYRE SAVE LTD,active,ltd,2013-08-02,"Unit 11 Merchants Way, Aldridge, Walsall, WS9 8SW",WS9 8SW,Aldridge,Walsall,45320,45320: Retail trade of motor vehicle parts and accessories,45320,tyre
07962013,SWITCH TYRE LTD,active,ltd,2012-02-23,"Wiltshire Tyre And Autocentre 2 Lancaster Road, Bowerhill, Melksham, SN12 6TT, England",SN12 6TT,Melksham,,45320,45320: Retail trade of motor vehicle parts and accessories,45320,tyre
12469843,BIRMINGHAM CITY TYRES LIMITED,active,ltd,2020-02-18,"247-249 Stratford Road, Sparkhill, Birmingham, B11 1QT, England",B11 1QT,Birmingham,,45320,45320: Retail trade of motor vehicle parts and accessories,45320,tyre
00717321,CABOT TYRE SERVICE LIMITED,active,ltd,1962-03-08,"Windsor Terrace, Totterdown, Bristol, BS3 4UG",BS3 4UG,Bristol,,45200; 45320,45200: Maintenance and repair of motor vehicles; 45320: Retail trade of motor vehicle parts and accessories,45320,tyre
05718111,ALLNIGHT TYRES LTD,active,ltd,2006-02-22,"167 Turners Hill, Cheshunt, Waltham Cross, Hertfordshire, EN8 9BH, England",EN8 9BH,Waltham Cross,Hertfordshire,45320,45320: Retail trade of motor vehicle parts and accessories,45320,tyre
09211740,CITY TYRE'S (UK) LIMITED,active,ltd,2014-09-10,"Unit 6 Bromyard Business Park, St. John's, Worcester, WR2 5EG, United Kingdom",WR2 5EG,Worcester,,45320,45320: Retail trade of motor vehicle parts and accessories,45320,tyre
14012709,KENT WHOLESALE TYRES LTD,active,ltd,2022-03-30,"120 Cavendish Place, Eastbourne, BN21 3TZ, England",BN21 3TZ,Eastbourne,,45320,45320: Retail trade of motor vehicle parts and accessories,45320,tyre
03853744,HOLDERNESS TYRE SERVICES LIMITED,active,ltd,1999-10-05,"Burstwick Service Station, Ellifoot Lane, Burstwick, East Yorkshire, HU12 9EF",HU12 9EF,Burstwick,East Yorkshire,45320,45320: Retail trade of motor vehicle parts and accessories,45320,tyre
10110497,BREDBURY TYRES LTD,active,ltd,2016-04-07,"Unit 1 Hollingworth Road, Bredbury, Stockport, SK6 2AR, England",SK6 2AR,Stockport,,45320,45320: Retail trade of motor vehicle parts and accessories,45320,tyre
09484961,SPEEDYS WHEELS & TYRES WALSALL LTD,active,ltd,2015-03-12,"263 Nottingham Road, Nottingham, NG7 7DA, England",NG7 7DA,Nottingham,,45320,45320: Retail trade of motor vehicle parts and accessories,45320,tyre
12457147,EUROPEAN TYRES DIRECT LTD,active,ltd,2020-02-12,"55 Ouse Road, Sheffield, South Yorkshire, S9 3AD, United Kingdom",S9 3AD,Sheffield,South Yorkshire,45320,45320: Retail trade of motor vehicle parts and accessories,45320,tyre
11819041,M60 MOBILE TYRES LTD,active,ltd,2019-02-11,"56 Dean Road, Cadishead, Manchester, M44 5AE, England",M44 5AE,Manchester,,45200; 45320; 49410,45200: Maintenance and repair of motor vehicles; 45320: Retail trade of motor vehicle parts and accessories; 49410,45320,tyre
11851274,ANGEL TYRES LTD,active,ltd,2019-02-27,"1-3 Tent Street, London, E1 5DQ, United Kingdom",E1 5DQ,London,,45320,45320: Retail trade of motor vehicle parts and accessories,45320,tyre
10089948,TREADMARK WHEELS AND TYRES LIMITED,active,ltd,2016-03-30,"Unit 3 Daleside Road, Colwick, Nottinghamshire, NG2 4DH, England",NG2 4DH,Colwick,Nottinghamshire,45320,45320: Retail trade of motor vehicle parts and accessories,45320,tyre
07609086,NIL'S TYRE SERVICES LIMITED,active,ltd,2011-04-19,"48b Bank Top, Blackburn, BB2 1TB, England",BB2 1TB,Blackburn,,45320,45320: Retail trade of motor vehicle parts and accessories,45320,tyre
10678828,TYRES ON THE RUN LIMITED,active,ltd,2017-03-20,"98 Commercial Road, London, E1 1NU, United Kingdom",E1 1NU,London,,45320,45320: Retail trade of motor vehicle parts and accessories,45320,tyre
00723112,VINTAGE TYRE SUPPLIES LIMITED,active,ltd,1962-05-04,"National Motor Museum, Beaulieu, Brockenhurst, Hants, SO42 7ZN",SO42 7ZN,Brockenhurst,Hants,45310; 45320,45310: Wholesale trade of motor vehicle parts and accessories; 45320: Retail trade of motor vehicle parts and accessories,45320; 45310,tyre
14672173,COBHAM TYRES LTD,active,ltd,2023-02-17,"Unit 8, 29-31 Cobham Unit 8, 29-31 Cobham Business Centre, Cobham Road, Ferndown Industrial Estate, Wimborne, BH21 7BX, United Kingdom",BH21 7BX,Wimborne,,45320,45320: Retail trade of motor vehicle parts and accessories,45320,tyre
13906444,CRYPTO TYRES LTD,active,ltd,2022-02-10,"389 Abbey Lane, Leicester, LE4 5QJ, United Kingdom",LE4 5QJ,Leicester,,45320,45320: Retail trade of motor vehicle parts and accessories,45320,tyre
SC334574,STEWARTRY TYRES LIMITED,active,ltd,2007-11-28,"51 Newall Terrace, Dumfries, DG1 1LN, Scotland",DG1 1LN,Dumfries,,45200; 45320,45200: Maintenance and repair of motor vehicles; 45320: Retail trade of motor vehicle parts and accessories,45320,tyre
15272159,SR TYRES WORLD LTD,active,ltd,2023-11-09,"Unit 12 Dane Street, Rochdale, OL12 6XB, England",OL12 6XB,Rochdale,,45320; 46770,45320: Retail trade of motor vehicle parts and accessories; 46770,45320,tyre
16116481,NEW BRIDGEGATE TYRES NEWCASTLE LIMITED,active,ltd,2024-12-03,"Quarriston Houghton Bank, Heighington, Darlington, Co Durham, DL2 2UF, United Kingdom",DL2 2UF,Darlington,Co Durham,45320,45320: Retail trade of motor vehicle parts and accessories,45320,tyre
06442119,OXFORD TYRE & BATTERY LTD.,active,ltd,2007-11-30,"Balcony Works, Oakworth Road, Keighley, West Yorkshire, BD21 1QP, United Kingdom",BD21 1QP,Keighley,West Yorkshire,45320,45320: Retail trade of motor vehicle parts and accessories,45320,tyre
08959854,WM TYRES MOBILE SERVICES LTD,active,ltd,2014-03-26,"Premier House, Rolfe Street, Smethwick, West Midlands, B66 2AA, England",B66 2AA,Smethwick,West Midlands,45200; 45320,45200: Maintenance and repair of motor vehicles; 45320: Retail trade of motor vehicle parts and accessories,45320,tyre
16124728,TYRES HUB LTD,active,ltd,2024-12-09,"17/18 Grange Lane, Accrington, BB5 2BU, England",BB5 2BU,Accrington,,45320,45320: Retail trade of motor vehicle parts and accessories,45320,tyre
13987187,COOL RUNNINGS TYRES LTD,active,ltd,2022-03-18,"374 Rotton Park Road, Birmingham, B16 0LA, England",B16 0LA,Birmingham,,45320,45320: Retail trade of motor vehicle parts and accessories,45320,tyre
08741941,TYRE DYNAMICS LIMITED,active,ltd,2013-10-22,"Westray Lower Bromstead Lane, Moreton, Newport, TF10 9DQ, England",TF10 9DQ,Newport,,45310; 45320,45310: Wholesale trade of motor vehicle parts and accessories; 45320: Retail trade of motor vehicle parts and accessories,45320; 45310,tyre
15667066,TYREMAN24 LIMITED,active,ltd,2024-04-22,"202 Barnardo Street, Shadwell, London, E1 0LL, United Kingdom",E1 0LL,London,,45200; 45320,45200: Maintenance and repair of motor vehicles; 45320: Retail trade of motor vehicle parts and accessories,45320,tyre
15224027,UK TRUCK LTD,active,ltd,2023-10-20,"31 Watford Metro Centre, Dwight Road, Watford, WD18 9SB, England",WD18 9SB,Watford,,45190; 45200; 45320; 77120,45190; 45200: Maintenance and repair of motor vehicles; 45320: Retail trade of motor vehicle parts and accessories; 77120,45320,truck
12537077,SBL TYRES & WHEELS LTD,active,ltd,2020-03-27,"Suite 8, 1-3 Little Titchfield Street, London, W1W 7BU, England",W1W 7BU,London,,45320,45320: Retail trade of motor vehicle parts and accessories,45320,tyre
10544461,XPRESS TYRES LTD,active,ltd,2017-01-03,"Unit 4 Church Street, Middleton, Manchester, M24 2PY, United Kingdom",M24 2PY,Manchester,,45320,45320: Retail trade of motor vehicle parts and accessories,45320,tyre
SC087421,NORTRUCK SERVICES LIMITED,active,ltd,1984-03-29,"Unit A Minto Avenue Unit A Minto Avenue, Altens Indusrial Estate, Aberdeen, AB12 3JZ, Scotland",AB12 3JZ,Aberdeen,,45320,45320: Retail trade of motor vehicle parts and accessories,45320,truck
SC433570,RANDOLPH TYRES & EXHAUSTS LTD,active,ltd,2012-09-28,"10 Randolph Place, Kirkcaldy, KY1 2YX, Scotland",KY1 2YX,Kirkcaldy,,45320,45320: Retail trade of motor vehicle parts and accessories,45320,tyre
08553330,THE TYRE PEOPLE LIMITED,active,ltd,2013-06-03,"Unit 3 Cornishway Industrial Estate, Manchester, M22 0WT",M22 0WT,Manchester,,45320,45320: Retail trade of motor vehicle parts and accessories,45320,tyre
15161657,MOBILE TYRE SOLUTIONS LTD,active,ltd,2023-09-25,"Acorn House, Bower Street, Oldham, OL1 3PH, United Kingdom",OL1 3PH,Oldham,,45320,45320: Retail trade of motor vehicle parts and accessories,45320,tyre
15222776,WEST GREEN TYRES LTD,active,ltd,2023-10-19,"327 West Green Road, London, N15 3PB, England",N15 3PB,London,,45320,45320: Retail trade of motor vehicle parts and accessories,45320,tyre
09489546,LONDON TYRES LIMITED,active,ltd,2015-03-13,"58 Alexandra Road, Enfield, EN3 7EH, England",EN3 7EH,Enfield,,45200; 45320,45200: Maintenance and repair of motor vehicles; 45320: Retail trade of motor vehicle parts and accessories,45320,tyre
12406887,RM1 TYRES LTD,active,ltd,2020-01-16,"117 Dartford Rd, Dartford, Kent, DA1 3EN, England",DA1 3EN,Dartford,Kent,45320,45320: Retail trade of motor vehicle parts and accessories,45320,tyre
10139111,MW TYRES LTD,active,ltd,2016-04-21,"Unit G Llay Hall Industrial Estste Mold Road, Cefn-Y-Bedd, Wrexham, LL12 9YG, United Kingdom",LL12 9YG,Wrexham,,45320,45320: Retail trade of motor vehicle parts and accessories,45320,tyre
SC194139,ARRAN FORK TRUCK SERVICES LIMITED,active,ltd,1999-03-09,"C/O Burgoyne Carey Pavilion 2, 3 Dava Street, Glasgow, G51 2JA",G51 2JA,Glasgow,,45320,45320: Retail trade of motor vehicle parts and accessories,45320,truck
15235838,MB TYRES & WHEELS LTD,active,ltd,2023-10-25,"423 Becontree Avenue, Dagenham, RM8 3UH, England",RM8 3UH,Dagenham,,45200; 45310; 45320,45200: Maintenance and repair of motor vehicles; 45310: Wholesale trade of motor vehicle parts and accessories; 45320: Retail trade of motor vehicle parts and accessories,45320; 45310,tyre
15165928,TYRE DENTON LIMITED,active,ltd,2023-09-26,"45 Unit 1, Palatine Street, Denton, M34 3LY, United Kingdom",M34 3LY,Denton,,45200; 45320,45200: Maintenance and repair of motor vehicles; 45320: Retail trade of motor vehicle parts and accessories,45320,tyre
08829711,MTR TYRES LTD,active,ltd,2014-01-02,"9-11 Stratford Road, Shirley, Solihull, B90 3LU, England",B90 3LU,Solihull,,45320,45320: Retail trade of motor vehicle parts and accessories,45320,tyre
15243164,PRUDHOE TYRE & BATTERY CO. LIMITED,active,ltd,2023-10-28,"58 Durham Road, Birtley, Chester Le Street, DH3 2QJ, England",DH3 2QJ,Chester Le Street,,45320,45320: Retail trade of motor vehicle parts and accessories,45320,tyre
11605036,TYRES DIRECT (HERTS) LTD,active,ltd,2018-10-04,"Castlemead House Castlemead Gardens, Hertingfordbury Road, Hertford, SG14 1JZ, United Kingdom",SG14 1JZ,Hertford,,45320,45320: Retail trade of motor vehicle parts and accessories,45320,tyre
14789371,SSB TYRE SERVICES LIMITED,active,ltd,2023-04-10,"Trilogy Suite 9 Church Street, Wednesfield, Wolverhampton, West Midlands, WV11 1SR, United Kingdom",WV11 1SR,Wolverhampton,West Midlands,45190; 45200; 45320; 96090,45190; 45200: Maintenance and repair of motor vehicles; 45320: Retail trade of motor vehicle parts and accessories; 96090,45320,tyre
08317619,DISCOUNT TYRE WAREHOUSE (HULL) LTD,active,ltd,2012-12-04,"72 Lairgate, Beverley, East Yorkshire, HU17 8EU, England",HU17 8EU,Beverley,East Yorkshire,45320,45320: Retail trade of motor vehicle parts and accessories,45320,tyre
14812241,MG TYRES LTD,active,ltd,2023-04-18,"C/O Burney Tomar Ltd 32 Nova Road, Croydon, Surrey, CR0 2TL, England",CR0 2TL,Surrey,,45320,45320: Retail trade of motor vehicle parts and accessories,45320,tyre
05902063,DISCOUNT TYRE DIRECT LIMITED,active,ltd,2006-08-10,"The Courtyard Shoreham Road, Upper Beeding, Steyning, West Sussex, BN44 3TN, United Kingdom",BN44 3TN,Steyning,West Sussex,45320,45320: Retail trade of motor vehicle parts and accessories,45320,tyre
04675976,ETC TYRES & EXHAUSTS LIMITED,active,ltd,2003-02-24,"First Floor 68 Uppermoor, Pudsey, Leeds, LS28 7EX, England",LS28 7EX,Leeds,,45320,45320: Retail trade of motor vehicle parts and accessories,45320,tyre
09480648,ML TYRES LTD,active,ltd,2015-03-10,"Unit 1, 355 Victoria Avenue, Manchester, Lancashire, M9 8WQ, England",M9 8WQ,Manchester,Lancashire,45320,45320: Retail trade of motor vehicle parts and accessories,45320,tyre
16146566,AS TYRES BAY LTD,active,ltd,2024-12-20,"129 Planetrees Road, Bradford, BD4 8DE, England",BD4 8DE,Bradford,,45320,45320: Retail trade of motor vehicle parts and accessories,45320,tyre
12653233,NEWHAM TYRES AND 3D ALIGNMENT LIMITED,active,ltd,2020-06-08,"83b High Street South, London, E6 6EJ, United Kingdom",E6 6EJ,London,,45200; 45320,45200: Maintenance and repair of motor vehicles; 45320: Retail trade of motor vehicle parts and accessories,45320,tyre
14665676,MS TYRES NORTHWEST LTD,active,ltd,2023-02-15,"Unit 3 Canterbury Street, Blackburn, BB2 2HP, England",BB2 2HP,Blackburn,,45320,45320: Retail trade of motor vehicle parts and accessories,45320,tyre
01208860,IMPERIAL TYRES LIMITED,active,ltd,1975-04-22,"Dunbeath Road, Elgin Industrial Estate, Swindon, Wiltshire, SN2 8EA",SN2 8EA,Swindon,Wiltshire,45320,45320: Retail trade of motor vehicle parts and accessories,45320,tyre
14062477,M A TYRES LTD,active,ltd,2022-04-22,"Unit 6 Bowland Street, Bradford, West Yorkshire, BD1 3BW, United Kingdom",BD1 3BW,Bradford,West Yorkshire,45320,45320: Retail trade of motor vehicle parts and accessories,45320,tyre
11255069,WINTANA TYRE WHOLESALE LTD,active,ltd,2018-03-14,"7 Convent Road, Ashford, Middlesex, TW15 2HJ, England",TW15 2HJ,Ashford,Middlesex,45320,45320: Retail trade of motor vehicle parts and accessories,45320,tyre
SC044321,"STUART, MCINTYRE & STUART (OAKBURN GARAGE) LIMITED",active,ltd,1967-02-14,"10 Duckburn Business Park, Dunblane, Perthshire, FK15 0EW",FK15 0EW,Dunblane,Perthshire,45200; 45310; 45320,45200: Maintenance and repair of motor vehicles; 45310: Wholesale trade of motor vehicle parts and accessories; 45320: Retail trade of motor vehicle parts and accessories,45320; 45310,tyre
11916143,MARGUM  TYRES LTD,active,ltd,2019-03-30,"31 Pritchard Close, Swindon, Wiltshire, SN2 7TZ, United Kingdom",SN2 7TZ,Swindon,Wiltshire,45200; 45320,45200: Maintenance and repair of motor vehicles; 45320: Retail trade of motor vehicle parts and accessories,45320,tyre
13250747,AOK TYRES LTD,active,ltd,2021-03-08,"36 Lichfield Street, Walsall, WS1 1TJ, England",WS1 1TJ,Walsall,,45320,45320: Retail trade of motor vehicle parts and accessories,45320,tyre
04379099,THE BLOCKLEY TYRE COMPANY LIMITED,active,ltd,2002-02-21,"18 Stratford Road, Shipston-On-Stour, CV36 4AU, England",CV36 4AU,Shipston-On-Stour,,45320,45320: Retail trade of motor vehicle parts and accessories,45320,tyre
16155223,HS HALIFAX TYRES LTD,active,ltd,2024-12-30,"58 Heath Lea, Halifax, West Yorkshire, HX1 2DA, United Kingdom",HX1 2DA,Halifax,West Yorkshire,45320,45320: Retail trade of motor vehicle parts and accessories,45320,tyre
12411469,ACE TYRES LTD,active,ltd,2020-01-20,"21 Mill Parade, Newport, NP20 2JQ, Wales",NP20 2JQ,Newport,,45320,45320: Retail trade of motor vehicle parts and accessories,45320,tyre
13827143,ACE MOBILE TYRES LTD,active,ltd,2022-01-04,"21 Mill Parade, Newport, NP20 2JQ, Wales",NP20 2JQ,Newport,,45320,45320: Retail trade of motor vehicle parts and accessories,45320,tyre
14490863,WYBERTON TYRE CENTRE LTD,active,ltd,2022-11-17,"Unit 4, 291 London Road, Boston, PE21 7DD, England",PE21 7DD,Boston,,45320,45320: Retail trade of motor vehicle parts and accessories,45320,tyre
12522011,MARSH TYRE SERVICES LTD,active,ltd,2020-03-17,"125 Feltham Hill Road, Ashford, TW15 1HE, England",TW15 1HE,Ashford,,45200; 45320,45200: Maintenance and repair of motor vehicles; 45320: Retail trade of motor vehicle parts and accessories,45320,tyre
08961111,CATS TYRES LTD,active,ltd,2014-03-26,"Office 12b Fanton Hall, Off Arterial Road, Wickford, Essex, SS12 9JF, England",SS12 9JF,Wickford,Essex,45320,45320: Retail trade of motor vehicle parts and accessories,45320,tyre
14779782,GREEN ZONE TYRES LTD,active,ltd,2023-04-04,"12 Cobden Street,, Salford, M6 6NA, United Kingdom",M6 6NA,Salford,,45200; 45320,45200: Maintenance and repair of motor vehicles; 45320: Retail trade of motor vehicle parts and accessories,45320,tyre
15300458,AKOY TYRES LTD,active,ltd,2023-11-21,"145-151 London Road, Croydon, CR0 2RG, England",CR0 2RG,Croydon,,45200; 45310; 45320; 96090,45200: Maintenance and repair of motor vehicles; 45310: Wholesale trade of motor vehicle parts and accessories; 45320: Retail trade of motor vehicle parts and accessories; 96090,45320; 45310,tyre
01410737,WALTON SUMMIT TRUCK CENTRE LIMITED,active,ltd,1979-01-22,"Unit 211 Walton Summit Road, Walton Summit Centre, Bamber, Bridge, Preston, Lancashire, PR5 8AQ, United Kingdom",PR5 8AQ,"Bridge, Preston",Lancashire,45190; 45200; 45320,45190; 45200: Maintenance and repair of motor vehicles; 45320: Retail trade of motor vehicle parts and accessories,45320,truck
16103078,BANOZE TYRES LTD,active,ltd,2024-11-26,"3 Downland Close, London, N20 9LB, England",N20 9LB,London,,45310; 45320,45310: Wholesale trade of motor vehicle parts and accessories; 45320: Retail trade of motor vehicle parts and accessories,45320; 45310,tyre
15351955,NEW & USED TYRES LIMITED,active,ltd,2023-12-14,"2 The Links, Herne Bay, Kent, CT6 7GQ, England",CT6 7GQ,Herne Bay,Kent,45320,45320: Retail trade of motor vehicle parts and accessories,45320,tyre
14033390,ISAAC TYRES BIRMINGHAM LIMITED,active,ltd,2022-04-07,"127 Whitehead Road, Birmingham, B6 6EN, England",B6 6EN,Birmingham,,45320; 46900; 47799,45320: Retail trade of motor vehicle parts and accessories; 46900: Non-specialised wholesale trade; 47799,45320,tyre
08454631,G T TYRES (CEREDIGION) LIMITED,active,ltd,2013-03-21,"G T Tyres, Castle Street, Cardigan, Ceredigion, SA43 3AA, Wales",SA43 3AA,Cardigan,Ceredigion,45320,45320: Retail trade of motor vehicle parts and accessories,45320,tyre
08920745,STUARTS TRUCK AND BUS LIMITED,active,ltd,2014-03-04,"Hill Barton Business Park Sidmouth Road, Clyst St Mary, Exeter, Devon, EX5 1DR",EX5 1DR,Exeter,Devon,45190; 45200; 45320,45190; 45200: Maintenance and repair of motor vehicles; 45320: Retail trade of motor vehicle parts and accessories,45320,truck
07774230,LIVEWIRE TYRES LIMITED,active,ltd,2011-09-14,"108 Station Road, Netley Abbey, Southampton, SO31 5AN, England",SO31 5AN,Southampton,,45320,45320: Retail trade of motor vehicle parts and accessories,45320,tyre
16078102,HILTON TYRE SERVICES LIMITED,active,ltd,2024-11-13,"Carter House, G2 Wyvern Court, Stanier Way, Derby, DE21 6BF, United Kingdom",DE21 6BF,Derby,,45320,45320: Retail trade of motor vehicle parts and accessories,45320,tyre
08184318,LANGLEY GREEN TYRES LTD,active,ltd,2012-08-20,"Langley Place, Langley Green, Crawley, RH11 7RT, United Kingdom",RH11 7RT,Crawley,,45320,45320: Retail trade of motor vehicle parts and accessories,45320,tyre
