company_number,company_name,status,company_type,date_of_creation,address,postcode,locality,region,sic_codes,sic_descriptions,matched_sic_codes,keywords_matched
15122807,RIVERSIDE TYRES LTD,active,ltd,2023-09-07,"Thompsons Yard, South Bank Road, Middlesbrough, TS3 8RQ, England",TS3 8RQ,Middlesbrough,,22110,22110: Manufacture of rubber tyres and tubes; retreading and rebuilding of rubber tyres,22110,tyre
02176950,TYRE EQUIPMENT CO LTD,active,ltd,1987-10-13,"Gonerby Road, Gonerby Hill Foot, Grantham, Lincolnshire, NG31 8HF",NG31 8HF,Grantham,Lincolnshire,22110; 46620,22110: Manufacture of rubber tyres and tubes; retreading and rebuilding of rubber tyres; 46620,22110,tyre
16044118,TAPKESHWAR TYRES LTD,active,ltd,2024-10-28,"Media House 1, Kingsburry Work Estate, Kingsburry, NW9 8UP, United Kingdom",NW9 8UP,Kingsburry,,22110,22110: Manufacture of rubber tyres and tubes; retreading and rebuilding of rubber tyres,22110,tyre
14067466,UNION TYRE CENTRE LTD,active,ltd,2022-04-25,"10-16 Great Union Street, Hull, HU9 1AL, England",HU9 1AL,Hull,,22110,22110: Manufacture of rubber tyres and tubes; retreading and rebuilding of rubber tyres,22110,tyre
15171440,YSL TYRES LTD,active,ltd,2023-09-28,"18-20 Tamworth Street, Oldham, OL9 7QY, England",OL9 7QY,Oldham,,22110,22110: Manufacture of rubber tyres and tubes; retreading and rebuilding of rubber tyres,22110,tyre
16048588,UK TOP TYRES LTD,active,ltd,2024-10-29,"42 Turnley Road, Birmingham, B34 7DP, England",B34 7DP,Birmingham,,22110,22110: Manufacture of rubber tyres and tubes; retreading and rebuilding of rubber tyres,22110,tyre
12473111,CORPORATE TYRES LTD,active,ltd,2020-02-20,"64 Alma Street, Luton, LU1 2PL, England",LU1 2PL,Luton,,22110,22110: Manufacture of rubber tyres and tubes; retreading and rebuilding of rubber tyres,22110,tyre
16190290,ST. NEOTS TYRES LIMITED,active,ltd,2025-01-17,"Unit 3b Oakpark Business Centre, Alington Road, Little Barford, St Neots, Bedfordshire, PE19 6WL, United Kingdom",PE19 6WL,"Little Barford, St Neots",Bedfordshire,22110; 45200,22110: Manufacture of rubber tyres and tubes; retreading and rebuilding of rubber tyres; 45200: Maintenance and repair of motor vehicles,22110,tyre
16141498,LA MOBILE TYRES LTD,active,ltd,2024-12-17,"2 Bennington Street, Blackburn, BB2 3HP, England",BB2 3HP,Blackburn,,22110,22110: Manufacture of rubber tyres and tubes; retreading and rebuilding of rubber tyres,22110,tyre
16144171,METRO TROCI TYRES LIMITED,active,ltd,2024-12-19,"Unit 2&3 Starkie Rd, Bolton, Great Manchester, BL2 2ED, United Kingdom",BL2 2ED,Bolton,Great Manchester,22110,22110: Manufacture of rubber tyres and tubes; retreading and rebuilding of rubber tyres,22110,tyre
16248370,ADDLESTONE TYRE CENTRE LTD,active,ltd,2025-02-12,"1-3 New Haw Road, Addlestone, KT15 2BZ, England",KT15 2BZ,Addlestone,,22110,22110: Manufacture of rubber tyres and tubes; retreading and rebuilding of rubber tyres,22110,tyre
16262244,TRUCK TYRE FLEET SERVICES LTD,active,ltd,2025-02-19,"1 Thorncliffe View, Leek, ST13 6QB, England",ST13 6QB,Leek,,22110,22110: Manufacture of rubber tyres and tubes; retreading and rebuilding of rubber tyres,22110,truck; tyre
16257253,M ALI TYRES LTD,active,ltd,2025-02-17,"69 Oliver Avenue, Manchester, United Kindom, M12 5SW, United Kingdom",M12 5SW,Manchester,United Kindom,22110,22110: Manufacture of rubber tyres and tubes; retreading and rebuilding of rubber tyres,22110,tyre
16305833,DL MOBILE TYRES LTD,active,ltd,2025-03-10,"Abergarw Service Station Llangeinor Road, Brynmenyn, Bridgend, CF32 9LY, Wales",CF32 9LY,Bridgend,,22110,22110: Manufacture of rubber tyres and tubes; retreading and rebuilding of rubber tyres,22110,tyre
16158800,BETTER TYRE LTD,active,ltd,2025-01-02,"162b Merton High Street, London, SW19 1AZ, England",SW19 1AZ,London,,22110,22110: Manufacture of rubber tyres and tubes; retreading and rebuilding of rubber tyres,22110,tyre
14723571,RICHIES MOBILE TYRE SERVICE LTD,active,ltd,2023-03-12,"24 Milling Road, Edgware, HA8 0PL, England",HA8 0PL,Edgware,,22110; 45200,22110: Manufacture of rubber tyres and tubes; retreading and rebuilding of rubber tyres; 45200: Maintenance and repair of motor vehicles,22110,tyre
16329733,AIRVAN MOBILE 24/7 TYRES LTD,active,ltd,2025-03-20,"7 Preston Road, Slough, SL2 5LP, England",SL2 5LP,Slough,,22110,22110: Manufacture of rubber tyres and tubes; retreading and rebuilding of rubber tyres,22110,tyre
15391114,4K TYRES LTD,active,ltd,2024-01-05,"1 Meyrick Street, Newtown, Wigan, WN5 9AN, England",WN5 9AN,Wigan,,22110; 45200,22110: Manufacture of rubber tyres and tubes; retreading and rebuilding of rubber tyres; 45200: Maintenance and repair of motor vehicles,22110,tyre
16342884,MANISH TYRES LTD,active,ltd,2025-03-25,"27 Chester Street, Middlesbrough, TS1 4NW, England",TS1 4NW,Middlesbrough,,22110,22110: Manufacture of rubber tyres and tubes; retreading and rebuilding of rubber tyres,22110,tyre
15144945,MACARTYS MOBILE TYRES LTD,active,ltd,2023-09-18,"16 Mead Close, Swanley, BR8 8DQ, England",BR8 8DQ,Swanley,,22110,22110: Manufacture of rubber tyres and tubes; retreading and rebuilding of rubber tyres,22110,tyre
00150903,COOPER TIRE & RUBBER COMPANY EUROPE LIMITED,active,ltd,1918-07-04,"2920 Trident Court Solihull Parkway, Birmingham Business Park, Birmingham, B37 7YN, England",B37 7YN,Birmingham,,22110; 22190,22110: Manufacture of rubber tyres and tubes; retreading and rebuilding of rubber tyres; 22190,22110,tire
16573785,QUICK FIX TYRES LTD,active,ltd,2025-07-10,"1 Briarfield Road, Farnworth, Bolton, BL4 0HD, England",BL4 0HD,Bolton,,22110,22110: Manufacture of rubber tyres and tubes; retreading and rebuilding of rubber tyres,22110,tyre
16590464,TYRERESQ1 LTD,active,ltd,2025-07-17,"3 Prince Charles Close, Southwick, Brighton, BN42 4PQ, England",BN42 4PQ,Brighton,,22110,22110: Manufacture of rubber tyres and tubes; retreading and rebuilding of rubber tyres,22110,tyre
13227286,NATIONWIDE TYRES DISTRIBUTION LTD,active,ltd,2021-02-25,"13227286 - COMPANIES HOUSE DEFAULT ADDRESS, Cardiff, CF14 8LH",CF14 8LH,Cardiff,,22110; 45310; 45320,22110: Manufacture of rubber tyres and tubes; retreading and rebuilding of rubber tyres; 45310: Wholesale trade of motor vehicle parts and accessories; 45320: Retail trade of motor vehicle parts and accessories,22110; 45310,tyre
16669617,REALISM TYRES LTD,active,ltd,2025-08-25,"8 Babington Road, London, SW16 6AP, England",SW16 6AP,London,,22110,22110: Manufacture of rubber tyres and tubes; retreading and rebuilding of rubber tyres,22110,tyre
16411170,ALL TYREZ LTD,active,ltd,2025-04-27,"57 Shelson Avenue, Feltham, TW13 4QS, England",TW13 4QS,Feltham,,22110; 96090,22110: Manufacture of rubber tyres and tubes; retreading and rebuilding of rubber tyres; 96090,22110,tyre
15576768,24HR TYRES ESSEX LIMITED,active,ltd,2024-03-19,"Unit 11 Readmans Industrial Estate Station Road, East Tilbury, Tilbury, RM18 8QR, England",RM18 8QR,Tilbury,,22110,22110: Manufacture of rubber tyres and tubes; retreading and rebuilding of rubber tyres,22110,tyre
16521887,BUCKS MOBILE TYRES LTD,active,ltd,2025-06-16,"Flat 12 Fleming Court Grange Road, Chalfont St. Peter, Gerrards Cross, SL9 9FL, England",SL9 9FL,Gerrards Cross,,22110,22110: Manufacture of rubber tyres and tubes; retreading and rebuilding of rubber tyres,22110,tyre
16103025,OLIVIER TYRES LTD,active,ltd,2024-11-26,"Unit 3 Arnwood Centre, Newark Road, Peterborough, PE1 5YH, England",PE1 5YH,Peterborough,,22110; 45200; 45400,22110: Manufacture of rubber tyres and tubes; retreading and rebuilding of rubber tyres; 45200: Maintenance and repair of motor vehicles; 45400,22110,tyre
16731796,CMS TYRES LTD,active,private-limited-guarant-nsc,2025-09-21,"69 Highfield Road, Dudley, DY2 7QE, England",DY2 7QE,Dudley,,22110,22110: Manufacture of rubber tyres and tubes; retreading and rebuilding of rubber tyres,22110,tyre
16752644,HOMEFIT TYRES LTD,active,ltd,2025-09-30,"Premier House, 46 Victoria Road, Burgess Hill, West Sussex, RH15 9LR, England",RH15 9LR,Burgess Hill,West Sussex,22110; 45200,22110: Manufacture of rubber tyres and tubes; retreading and rebuilding of rubber tyres; 45200: Maintenance and repair of motor vehicles,22110,tyre
16837225,GYTYRES LIMITED,active,ltd,2025-11-06,"41 Lords Lane, Bradwell, Great Yarmouth, NR31 8NY, England",NR31 8NY,Great Yarmouth,,22110,22110: Manufacture of rubber tyres and tubes; retreading and rebuilding of rubber tyres,22110,tyre
14593145,RE-TYRE LIMITED,active,ltd,2023-01-16,"Unit 5 Sherrington Way, Lister Road, Industrial Estate, Basingstoke, Hants, RG22 4DQ, England",RG22 4DQ,Basingstoke,Hants,22110,22110: Manufacture of rubber tyres and tubes; retreading and rebuilding of rubber tyres,22110,tyre
16790320,HERSHAM TYRES LTD,active,ltd,2025-10-16,"Unit C Common Road, Studham Place, Dunstable, LU6 2FU, United Kingdom",LU6 2FU,Dunstable,,22110,22110: Manufacture of rubber tyres and tubes; retreading and rebuilding of rubber tyres,22110,tyre
16788695,GLOBAL TYRES GROUP LIMITED,active,ltd,2025-10-16,"L220,Beaconside Business Village,, Stafford Enterprise Park,Weston Road, Stafford, ST18 0BF, United Kingdom",ST18 0BF,Stafford,,22110; 45310; 45320; 82990,22110: Manufacture of rubber tyres and tubes; retreading and rebuilding of rubber tyres; 45310: Wholesale trade of motor vehicle parts and accessories; 45320: Retail trade of motor vehicle parts and accessories; 82990: Other business support service activities n.e.c.,22110; 45310,tyre
SC871554,GOLDIES MOBILE TYRES LIMITED,active,ltd,2025-12-02,"78 Glenburn Road, North Berwick, EH39 4DH, Scotland",EH39 4DH,North Berwick,,22110,22110: Manufacture of rubber tyres and tubes; retreading and rebuilding of rubber tyres,22110,tyre
16749270,REVDON TYRES LTD,active,ltd,2025-09-29,"71a Approach Road, London, E2 9LY, England",E2 9LY,London,,22110,22110: Manufacture of rubber tyres and tubes; retreading and rebuilding of rubber tyres,22110,tyre
16820547,SAN TYRES (UK) LIMITED,active,ltd,2025-10-30,"1a Burgoyne Road, London, N4 1AA, England",N4 1AA,London,,22110,22110: Manufacture of rubber tyres and tubes; retreading and rebuilding of rubber tyres,22110,tyre
16938576,FLY TYRE LTD,active,ltd,2026-01-01,"11 Ruskin Way, Aylesbury, Buckinghamshire, HP20 2EL, England",HP20 2EL,Aylesbury,Buckinghamshire,22110,22110: Manufacture of rubber tyres and tubes; retreading and rebuilding of rubber tyres,22110,tyre
16940023,HAGLEY MOBILE TYRES LIMITED,active,ltd,2026-01-02,"Springfield, Bank Street, Stourbridge, DY9 8TR, England",DY9 8TR,Stourbridge,,22110; 45320,22110: Manufacture of rubber tyres and tubes; retreading and rebuilding of rubber tyres; 45320: Retail trade of motor vehicle parts and accessories,22110,tyre
14020877,MR TYREMAN (BFD) LTD,active,ltd,2022-04-02,"396 Idle Road, Five Lane Ends, Bradford, BD2 2AW, England",BD2 2AW,Bradford,,22110,22110: Manufacture of rubber tyres and tubes; retreading and rebuilding of rubber tyres,22110,tyre
16914677,24 HOURS TYRES CARDIFF LTD,active,ltd,2025-12-16,"20 Bessemer Road, Cardiff, CF11 8BA, Wales",CF11 8BA,Cardiff,,22110; 45320,22110: Manufacture of rubber tyres and tubes; retreading and rebuilding of rubber tyres; 45320: Retail trade of motor vehicle parts and accessories,22110,tyre
16704314,CE TYRES LTD,active,ltd,2025-09-09,"1-3 Manor Lodge Manor Lane, Holmes Chapel, Crewe, CW4 8AB, England",CW4 8AB,Crewe,,22110,22110: Manufacture of rubber tyres and tubes; retreading and rebuilding of rubber tyres,22110,tyre
16974873,TYRE EXPRESS FIT LTD,active,ltd,2026-01-20,"13 Green Lane Close, Leicester, LE5 4NJ, United Kingdom",LE5 4NJ,Leicester,,22110,22110: Manufacture of rubber tyres and tubes; retreading and rebuilding of rubber tyres,22110,tyre
05120484,ROKIT TYRES LIMITED,active,ltd,2004-05-06,"Rokit House Kingswood Business Park, Holyhead Road, Albrighton, Staffordshire, WV7 3AU, United Kingdom",WV7 3AU,Albrighton,Staffordshire,45310,45310: Wholesale trade of motor vehicle parts and accessories,45310,tyre
07245019,3G TRUCK & TRAILER PARTS LTD,active,ltd,2010-05-06,"Barbot Hall Industrial Estate Mangham Road, Parkgate, Rotherham, S62 6EF, England",S62 6EF,Rotherham,,45310,45310: Wholesale trade of motor vehicle parts and accessories,45310,truck
11477160,B1 TYRES ONLINE LTD,active,ltd,2018-07-23,"Unit B, 43-49 Fowler Road, Hainault, Ilford, IG6 3UL",IG6 3UL,Hainault,Ilford,45310,45310: Wholesale trade of motor vehicle parts and accessories,45310,tyre
02555001,TRUCKMASTERS HANDLING LIMITED,active,ltd,1990-11-05,"Boston Road, Wainfleet, Skegness Lincolnshire, PE24 4HA",PE24 4HA,Skegness Lincolnshire,,45190; 45310,45190; 45310: Wholesale trade of motor vehicle parts and accessories,45310,truck
07594561,MASTERPART TRUCK AND BUS LIMITED,active,ltd,2011-04-06,"Green Acres Green Lane, Hodthorpe, Worksop, S80 4XR",S80 4XR,Worksop,,45310,45310: Wholesale trade of motor vehicle parts and accessories,45310,truck
12842521,SWEDISH TRUCK PARTS GROUP LIMITED,active,ltd,2020-08-27,"86 Heywood Street, Manchester, M8 0TD, England",M8 0TD,Manchester,,45310,45310: Wholesale trade of motor vehicle parts and accessories,45310,truck
SC197337,NORDIC TYRES (UK) LIMITED,active,ltd,1999-06-18,"Nordic Tyres Lochside Industrial Estate, Irongray Road, Dumfries, DG2 0HS, Scotland",DG2 0HS,Dumfries,,45310,45310: Wholesale trade of motor vehicle parts and accessories,45310,tyre
12638444,BENJYTYRES&SERVICE LTD,active,ltd,2020-06-02,"424 Margate Road Westwood, Ramsgate, Kent, CT12 6SJ, England",CT12 6SJ,Ramsgate,Kent,45310,45310: Wholesale trade of motor vehicle parts and accessories,45310,tyre
06624708,WIMBORNE TYRES & AUTO CENTRE LTD,active,ltd,2008-06-19,"Unit 3 28 Brook Road, Wimborne, Dorset, BH21 2BH",BH21 2BH,Wimborne,Dorset,45310,45310: Wholesale trade of motor vehicle parts and accessories,45310,tyre
11432664,DEALS ON TYRES LIMITED,active,ltd,2018-06-25,"244 Kilburn High Road, London, NW6 2BS, England",NW6 2BS,London,,45310,45310: Wholesale trade of motor vehicle parts and accessories,45310,tyre
03944869,TEDDINGTON TYRES LIMITED,active,ltd,2000-03-10,"161 Kingston Road, Teddington, TW11 9JP, England",TW11 9JP,Teddington,,45310,45310: Wholesale trade of motor vehicle parts and accessories,45310,tyre
SC103693,SCOTYRE INTERNATIONAL LIMITED,active,ltd,1987-03-16,"8 Newbridge Industrial Estate, Newbridge Industrial Estate, Newbridge, EH28 8PJ, Scotland",EH28 8PJ,Newbridge,,45310,45310: Wholesale trade of motor vehicle parts and accessories,45310,tyre
09751276,IDF TRUCK PARTS LIMITED,active,ltd,2015-08-27,"21 Meadow Walk, Astley, Manchester, M29 7FA, United Kingdom",M29 7FA,Manchester,,45310,45310: Wholesale trade of motor vehicle parts and accessories,45310,truck
07827697,KELNIK TYRES LTD,active,ltd,2011-10-28,"160 Elliott Street, Tyldesley, Manchester, M29 8DS, England",M29 8DS,Manchester,,45310,45310: Wholesale trade of motor vehicle parts and accessories,45310,tyre
04854184,WREXHAM TRUCK & TRAILER LTD,active,ltd,2003-08-01,"Unit 17 Miners Road, Llay Industrial Estate, Llay, Wrexham, LL12 0PJ, Wales",LL12 0PJ,Wrexham,,45310,45310: Wholesale trade of motor vehicle parts and accessories,45310,truck
12653560,TEAM VALLEY TYRES LTD,active,ltd,2020-06-08,"381c Jedburgh Court, Team Valley Trading Estate, Gateshead, NE11 0BQ, United Kingdom",NE11 0BQ,Gateshead,,45310,45310: Wholesale trade of motor vehicle parts and accessories,45310,tyre
05842294,TREADRIGHT TYRES LIMITED,active,ltd,2006-06-09,"349 Bury Old Rd, Prestwich, Manchester, M25 1PY",M25 1PY,Manchester,,45310,45310: Wholesale trade of motor vehicle parts and accessories,45310,tyre
03483555,LINCOLNSHIRE TYRE CO. LIMITED,active,ltd,1997-12-19,"Warwick Road, Fairfield Industrial Estate, Louth, Lincolnshire, LN11 0YB",LN11 0YB,Louth,Lincolnshire,45310,45310: Wholesale trade of motor vehicle parts and accessories,45310,tyre
05847441,DIRECT TYRE SERVICES & MOT CENTRE LIMITED,active,ltd,2006-06-15,"Suite 1 Aireside House, Royd Ings Avenue, Keighley, West Yorkshire, BD21 4BZ, England",BD21 4BZ,Keighley,West Yorkshire,45310,45310: Wholesale trade of motor vehicle parts and accessories,45310,tyre
10460101,TAF FECHAN TYRES LTD,active,ltd,2016-11-03,"Suite 3 13 Cathedral Road, Cardiff, CF11 9HA, United Kingdom",CF11 9HA,Cardiff,,45310,45310: Wholesale trade of motor vehicle parts and accessories,45310,tyre
15825676,GREAT TRUCK & PARTS UK LIMITED,active,ltd,2024-07-08,"40 Heaton Gardens, Hendon, London, NW4 4XS, United Kingdom",NW4 4XS,Hendon,London,45310; 46770,45310: Wholesale trade of motor vehicle parts and accessories; 46770,45310,truck
14956097,ZAK WHOLESALE TYRES LTD,active,ltd,2023-06-23,"Unit 1 (Style Furnitures), Grange Lane, Accrington, BB5 2BU, United Kingdom",BB5 2BU,Accrington,,45310,45310: Wholesale trade of motor vehicle parts and accessories,45310,tyre
08605378,TYREWISE SERVICES LONDON LIMITED,active,ltd,2013-07-11,"Units 1 & 2 Field View, Baynards Green Business Park Baynards Green, Nr Bicester, Oxfordshire, OX27 7SG",OX27 7SG,Nr Bicester,Oxfordshire,45310,45310: Wholesale trade of motor vehicle parts and accessories,45310,tyre
08778756,AM PLANT & TRUCK COMMERCIAL LIMITED,active,ltd,2013-11-18,"Clipper House Tilbury Freeport Clipper House Tilbury Freeport, Suit No. 4, Tilbury, Essex, RM18 7SG, United Kingdom",RM18 7SG,Tilbury,Essex,45310,45310: Wholesale trade of motor vehicle parts and accessories,45310,truck
14938687,N TYRES LTD,active,ltd,2023-06-15,"424 London Road, Westcliff-On-Sea, SS0 9LA, England",SS0 9LA,Westcliff-On-Sea,,45310,45310: Wholesale trade of motor vehicle parts and accessories,45310,tyre
SC351014,EASITYRE LTD.,active,ltd,2008-11-07,"2-3 Blackwood Road, Eastfield Industrial Estate, Glenrothes, KY7 4NP, Scotland",KY7 4NP,Glenrothes,,45310,45310: Wholesale trade of motor vehicle parts and accessories,45310,tyre
10291471,TIRE LIMITED,active,ltd,2016-07-22,"100 Great George Street, Preston, PR1 1TJ, England",PR1 1TJ,Preston,,45310,45310: Wholesale trade of motor vehicle parts and accessories,45310,tire
15866055,ASIA TRUCKS LTD,active,ltd,2024-07-30,"94 Brangwyn Grove, Bristol, BS7 9UD, England",BS7 9UD,Bristol,,45310,45310: Wholesale trade of motor vehicle parts and accessories,45310,truck
SC368574,TYRERACK EUROPE LTD,active,ltd,2009-11-16,"5 Knockdhu Place, Gourock, Renfrewshire, PA19 1DP",PA19 1DP,Gourock,Renfrewshire,45310,45310: Wholesale trade of motor vehicle parts and accessories,45310,tyre
08467686,A & S TYRES LIMITED,active,ltd,2013-04-02,"A & S Tyres Station Road, Briton Ferry, Neath, SA11 2SU",SA11 2SU,Neath,,45310,45310: Wholesale trade of motor vehicle parts and accessories,45310,tyre
07541566,THE TYRE SHOP (LEIC) LTD,active,ltd,2011-02-24,"109 Coleman Road, Leicester, LE5 4LE",LE5 4LE,Leicester,,45310,45310: Wholesale trade of motor vehicle parts and accessories,45310,tyre
15933278,PRIME TREAD TYRES LTD,active,ltd,2024-09-03,"71-75 Shelton Street, Covent Garden, London, WC2H 9JQ, United Kingdom",WC2H 9JQ,London,,45310,45310: Wholesale trade of motor vehicle parts and accessories,45310,tyre
04241114,BRAISWICK TYRES LIMITED,active,ltd,2001-06-26,"47 Butt Road, Colchester, Essex, CO3 3BZ, United Kingdom",CO3 3BZ,Colchester,Essex,45310,45310: Wholesale trade of motor vehicle parts and accessories,45310,tyre
02852981,TRUCK TRAILER + BUS COMPONENTS LIMITED,active,ltd,1993-09-14,"Unit 16 Plot 51, Village Farm Industrial Estate, Pyle, Mid-Glamorgan, CF33 6NH",CF33 6NH,Pyle,Mid-Glamorgan,45310,45310: Wholesale trade of motor vehicle parts and accessories,45310,truck
12793841,LEE'S TRADE TYRES LIMITED,active,ltd,2020-08-05,"65 St. Aubins Avenue, Southampton, SO19 8NU, England",SO19 8NU,Southampton,,45310,45310: Wholesale trade of motor vehicle parts and accessories,45310,tyre
14625268,TIA UK TYRES LIMITED,active,ltd,2023-01-30,"Units C & D, Halesfield 14, Telford, Shropshire, TF7 4QR, United Kingdom",TF7 4QR,Telford,Shropshire,45310,45310: Wholesale trade of motor vehicle parts and accessories,45310,tyre
08170450,ENDYKE TYRES LIMITED,active,ltd,2012-08-07,"Station Yard, Horncastle, Lincolnshire, LN9 5AQ",LN9 5AQ,Horncastle,Lincolnshire,45310,45310: Wholesale trade of motor vehicle parts and accessories,45310,tyre
15088385,ALFA GREEN TYRES UK LTD,active,ltd,2023-08-22,"3 Greenshield Industrial Estate, Bradfield Road, London, E16 2AU, England",E16 2AU,London,,45310,45310: Wholesale trade of motor vehicle parts and accessories,45310,tyre
08228430,TYRESAVE MCR UK LTD,active,ltd,2012-09-25,"78 Chorley New Road, Bolton, BL1 4BY, England",BL1 4BY,Bolton,,45310,45310: Wholesale trade of motor vehicle parts and accessories,45310,tyre
15879263,TYRE WHOLESALE AND RECYCLING LTD,active,ltd,2024-08-05,"Unit 3 Apex Trading Estate, Lower Eccleshill Road, Darwen, BB3 0RP, England",BB3 0RP,Darwen,,45310,45310: Wholesale trade of motor vehicle parts and accessories,45310,tyre
12598583,TYRE HOUSE LTD,active,ltd,2020-05-13,"R/O 156, Unit E, New Road, Rainham, Essex, RM13 8RS, England",RM13 8RS,Rainham,Essex,45310,45310: Wholesale trade of motor vehicle parts and accessories,45310,tyre
12043713,MLT TYRES LTD,active,ltd,2019-06-11,"1b Planet Park Planet Road, Adwick-Le-Street, Doncaster, DN6 7AW, England",DN6 7AW,Doncaster,,45310,45310: Wholesale trade of motor vehicle parts and accessories,45310,tyre
05733614,TRUCK TYRE SOLUTIONS LTD,active,ltd,2006-03-07,"Station Road, Rowley Regis, W Midlands, B65 0LJ, United Kingdom",B65 0LJ,Rowley Regis,W Midlands,45310,45310: Wholesale trade of motor vehicle parts and accessories,45310,truck; tyre
06399242,TOP GEAR TYRE CENTRE LIMITED,active,ltd,2007-10-15,"116 Duke Street, Liverpool, Merseyside, L1 5JW, England",L1 5JW,Liverpool,Merseyside,45310,45310: Wholesale trade of motor vehicle parts and accessories,45310,tyre
09711763,INDUSTRIAL TYRE NETWORK LTD,active,ltd,2015-07-31,"Unit 4 Manor Road, Slade Health, Wolverhampton, WV10 7NZ, England",WV10 7NZ,Wolverhampton,,45310,45310: Wholesale trade of motor vehicle parts and accessories,45310,tyre
04267732,WARRINGTON TRUCK PARTS LIMITED,active,ltd,2001-08-09,"8 Rivington Court, Hardwick Grange, Woolston, Warrington, WA1 4RT",WA1 4RT,Woolston,Warrington,45310,45310: Wholesale trade of motor vehicle parts and accessories,45310,truck
07331163,A C F (TRUCK PARTS) LTD,active,ltd,2010-07-30,"23 Mountside, Stanmore, Middlesex, HA7 2DS",HA7 2DS,Stanmore,Middlesex,45310,45310: Wholesale trade of motor vehicle parts and accessories,45310,truck
04087390,A D TYRES (WHOLESALE) LIMITED,active,ltd,2000-10-10,"Alice Head Farm Alicehead Road, Ashover, Chesterfield, S45 0DQ, England",S45 0DQ,Chesterfield,,45310,45310: Wholesale trade of motor vehicle parts and accessories,45310,tyre
05045310,DISCOUNT TYRES & WHEELS LIMITED,active,ltd,2004-02-16,"Belgrave House, 39-43 Monument Hill, Weybridge, Surrey, KT13 8RN",KT13 8RN,Weybridge,Surrey,45310,45310: Wholesale trade of motor vehicle parts and accessories,45310,tyre
10239942,STONEY BARGAIN TYRES LIMITED,active,ltd,2016-06-20,"586 Stoney Stanton Road, Coventry, CV6 5FS, United Kingdom",CV6 5FS,Coventry,,45310,45310: Wholesale trade of motor vehicle parts and accessories,45310,tyre
04272905,FAREHAM TYRES LIMITED,active,ltd,2001-08-17,"160 Fareham Road, Gosport, Hampshire, PO13 0FN, England",PO13 0FN,Gosport,Hampshire,45310,45310: Wholesale trade of motor vehicle parts and accessories,45310,tyre
07747704,G B TYRES (UK) LTD,active,ltd,2011-08-22,"Barnfield Road, Barnfield Road, Tipton, DY4 9DE, England",DY4 9DE,Tipton,,45310,45310: Wholesale trade of motor vehicle parts and accessories,45310,tyre
14334981,ALPHA TYRES LTD,active,ltd,2022-09-05,"190 Billet Road, London, E17 5DX, United Kingdom",E17 5DX,London,,45310; 96090,45310: Wholesale trade of motor vehicle parts and accessories; 96090,45310,tyre
16065645,BUS AND TRUCK PARTS (UK) LIMITED,active,ltd,2024-11-07,"Flat 12 The Brew House, 211 Ecclesall Road, Sheffield, S11 8HG, England",S11 8HG,Sheffield,,45310,45310: Wholesale trade of motor vehicle parts and accessories,45310,truck
06815409,TRUCKWARE LIMITED,active,ltd,2009-02-10,"40-42 Rushey Lane, Tyseley, Birmingham, B11 2BL, England",B11 2BL,Birmingham,,45310,45310: Wholesale trade of motor vehicle parts and accessories,45310,truck
14670533,TYRE SHAK LTD,active,ltd,2023-02-17,"32 Thurlby Road, Leicester, Leicestershire, LE5 3PD, United Kingdom",LE5 3PD,Leicester,Leicestershire,45310,45310: Wholesale trade of motor vehicle parts and accessories,45310,tyre
02775586,DONOVAN TYRES LIMITED,active,ltd,1992-12-21,"167 Turners Hill, Cheshunt, Herts, EN8 9BH",EN8 9BH,Cheshunt,Herts,45310,45310: Wholesale trade of motor vehicle parts and accessories,45310,tyre
14564061,HAMZA TYRES LTD,active,ltd,2022-12-30,"7 Kenton Avenue, Wolverhampton, WV6 0RG, England",WV6 0RG,Wolverhampton,,45310,45310: Wholesale trade of motor vehicle parts and accessories,45310,tyre
10541363,W G TYRES (BILLINGSHURST) LTD,active,ltd,2016-12-28,"Station House, Station Road, Billingshurst, W Sussex, RH14 9SE, United Kingdom",RH14 9SE,Billingshurst,W Sussex,45310,45310: Wholesale trade of motor vehicle parts and accessories,45310,tyre
16086904,GENCO TIRE LIMITED,active,ltd,2024-11-18,"13 Dryden Avenue, London, W7 1ES, England",W7 1ES,London,,45310,45310: Wholesale trade of motor vehicle parts and accessories,45310,tire
01853463,ADVANCE TYRES HOLDINGS LIMITED,active,ltd,1984-10-08,"975 Mollison Avenue, Enfield, Middlesex, EN3 7NN, England",EN3 7NN,Enfield,Middlesex,45310; 68209; 70100,45310: Wholesale trade of motor vehicle parts and accessories; 68209; 70100,45310,tyre
13339872,TRUCK BITS LTD,active,ltd,2021-04-16,"1 Fisher Lane, Bingham, Nottingham, NG13 8BQ, England",NG13 8BQ,Nottingham,,25610; 45310,25610; 45310: Wholesale trade of motor vehicle parts and accessories,45310,truck
11270399,TYRE TRADE (LONDON) LTD,active,ltd,2018-03-22,"12 Allen Road, Sunbury-On-Thames, TW16 5LS, United Kingdom",TW16 5LS,Sunbury-On-Thames,,45310,45310: Wholesale trade of motor vehicle parts and accessories,45310,tyre
