company_number,company_name,status,company_type,date_of_creation,address,postcode,locality,region,sic_codes,sic_descriptions,matched_sic_codes,keywords_matched
14505722,DJ TYRES LIMITED,active,ltd,2022-11-25,"30 Bardsey Crescent, Llanishen, Cardiff, Caerdydd, CF14 5LA, Wales",CF14 5LA,Cardiff,Caerdydd,45320,45320: Retail trade of motor vehicle parts and accessories,45320,tyre
12468767,BRADLOR TYRES LTD,active,ltd,2020-02-18,"128 City Road, London, EC1V 2NX, United Kingdom",EC1V 2NX,London,,45320,45320: Retail trade of motor vehicle parts and accessories,45320,tyre
07515476,HORNDEAN TYRES LTD,active,ltd,2011-02-03,"Units 8 & 9, Westfield Industrial Estate Horndean, Waterlooville, Hants, PO8 9JX",PO8 9JX,Waterlooville,Hants,45320,45320: Retail trade of motor vehicle parts and accessories,45320,tyre
13735640,TURNER TYRES LTD,active,ltd,2021-11-10,"Airways Service Station, Fifers Lane, Norwich, NR6 6HN, England",NR6 6HN,Norwich,,45310; 45320,45310: Wholesale trade of motor vehicle parts and accessories; 45320: Retail trade of motor vehicle parts and accessories,45320; 45310,tyre
16103922,OGATI TYRES LIMITED,active,ltd,2024-11-27,"Unit 34-35 Staunton Court, Staunton, Gloucester, GL19 3QS, United Kingdom",GL19 3QS,Gloucester,,45310; 45320,45310: Wholesale trade of motor vehicle parts and accessories; 45320: Retail trade of motor vehicle parts and accessories,45320; 45310,tyre
13814795,A40 TYRES LTD,active,ltd,2021-12-22,"412-416 London Road, High Wycombe, HP11 1LP, England",HP11 1LP,High Wycombe,,33170; 45310; 45320,33170: Repair and maintenance of other transport equipment; 45310: Wholesale trade of motor vehicle parts and accessories; 45320: Retail trade of motor vehicle parts and accessories,45320; 45310; 33170,tyre
16001759,MA MOBILE TYRES LTD,active,ltd,2024-10-07,"15 Park Road, Farnborough, Hampshire, GU14 6LQ, United Kingdom",GU14 6LQ,Farnborough,Hampshire,45320,45320: Retail trade of motor vehicle parts and accessories,45320,tyre
15148128,COOPERS TYRES LTD,active,ltd,2023-09-19,"Unit 1 Nant Court Glenview Terrace, Llanbradach, Caerphilly, CF83 3RX, Wales",CF83 3RX,Caerphilly,,45320,45320: Retail trade of motor vehicle parts and accessories,45320,tyre
14378411,T D TYRES (SOUTHWEST) LIMITED,active,ltd,2022-09-27,"Unit 34-35 Staunton Court Ledbury Road, Staunton, Gloucester, GL19 3QS, England",GL19 3QS,Gloucester,,45310; 45320,45310: Wholesale trade of motor vehicle parts and accessories; 45320: Retail trade of motor vehicle parts and accessories,45320; 45310,tyre
01795798,PARFITT TYRE CO. LTD,active,ltd,1984-02-29,"Seawall Road, Tremorfa, Cardiff, S Glamorgan, CF24 5TH, United Kingdom",CF24 5TH,Cardiff,S Glamorgan,45320,45320: Retail trade of motor vehicle parts and accessories,45320,tyre
15463466,BOBS MOBILE TYRES LTD,active,ltd,2024-02-03,"Brunel House 11 The Promenade, Clifton, Bristol, BS8 3NG, United Kingdom",BS8 3NG,Bristol,,45320,45320: Retail trade of motor vehicle parts and accessories,45320,tyre
13876943,KK TYRES (WM) LTD,active,ltd,2022-01-27,"36 Lichfield Street, Walsall, WS1 1TJ, England",WS1 1TJ,Walsall,,45320,45320: Retail trade of motor vehicle parts and accessories,45320,tyre
02674485,D.A.T. TYRE SUPPLIES LIMITED,active,ltd,1991-12-30,"Units A3-A5 Suttons Business Park, 136 New Road, Rainham, Essex, RM13 8DE, England",RM13 8DE,Rainham,Essex,45320,45320: Retail trade of motor vehicle parts and accessories,45320,tyre
16083608,FAREHAM BUDGET TYRE EXPRESS LTD,active,ltd,2024-11-15,"94 Western Road, Fareham, Hampshire, PO16 0NP, United Kingdom",PO16 0NP,Fareham,Hampshire,45200; 45320,45200: Maintenance and repair of motor vehicles; 45320: Retail trade of motor vehicle parts and accessories,45320,tyre
16109536,ASHTON MOBILE TYRES LTD,active,ltd,2024-11-29,"37 Hill Street, Ashton-Under-Lyne, Lancashire, OL7 0PZ, United Kingdom",OL7 0PZ,Ashton-Under-Lyne,Lancashire,45320,45320: Retail trade of motor vehicle parts and accessories,45320,tyre
12383806,S&S ROAD TYRES LIMITED,active,ltd,2020-01-02,"Unit 1 Alpha Business Park Lamberhead Industrial Estate, Leopold Street, Wigan, Lancashire, WN5 8EF, England",WN5 8EF,Wigan,Lancashire,45310; 45320,45310: Wholesale trade of motor vehicle parts and accessories; 45320: Retail trade of motor vehicle parts and accessories,45320; 45310,tyre
10498749,VALENTINE'S TYRES LTD,active,ltd,2016-11-28,"The Highway, New Inn, Pontypool, NP4 0PW, United Kingdom",NP4 0PW,Pontypool,,45320,45320: Retail trade of motor vehicle parts and accessories,45320,tyre
14671291,DUDLEY ROAD TYRE SERVICES LTD,active,ltd,2023-02-17,"141 Dudley Road East, Oldbury, B69 3DU, England",B69 3DU,Oldbury,,45320,45320: Retail trade of motor vehicle parts and accessories,45320,tyre
08966821,FLAXLEY TYRES LIMITED,active,ltd,2014-03-31,"Unit 1, Imex Business Park, Flaxley Road, Birmingham, B33 9AL",B33 9AL,Birmingham,,45320,45320: Retail trade of motor vehicle parts and accessories,45320,tyre
11402976,WICKER TYRES (UTE) LTD,active,ltd,2018-06-07,"4 Walker Street, Wicker Arches, Sheffield, South Yorkshire, S3 8GZ, United Kingdom",S3 8GZ,Sheffield,South Yorkshire,45320,45320: Retail trade of motor vehicle parts and accessories,45320,tyre
16038977,JBMR TYRES LTD,active,ltd,2024-10-24,"47 Cornwall Avenue, Southall, UB1 2TE, England",UB1 2TE,Southall,,45320,45320: Retail trade of motor vehicle parts and accessories,45320,tyre
14446340,WEMBLEY HIGH ROAD TYRES LTD,active,ltd,2022-10-27,"608 High Road, Wembley, HA0 2AF, England",HA0 2AF,Wembley,,45320,45320: Retail trade of motor vehicle parts and accessories,45320,tyre
00877236,TYRES(KING'S LYNN)LIMITED,active,ltd,1966-04-19,"Austin Field, Kings Lynn, Norfolk, PE30 1PH",PE30 1PH,Norfolk,,45320,45320: Retail trade of motor vehicle parts and accessories,45320,tyre
01061193,TYRECARE (ST.HELENS)LIMITED,active,ltd,1972-07-11,"45 Dentons Green Lane, Dentons Green, St. Helens, Merseyside, WA10 2QF, England",WA10 2QF,St. Helens,Merseyside,45310; 45320,45310: Wholesale trade of motor vehicle parts and accessories; 45320: Retail trade of motor vehicle parts and accessories,45320; 45310,tyre
14597662,WHITTON'S TYRES LTD,active,ltd,2023-01-17,"322 Nelson Road, Twickenham, TW2 7AH, England",TW2 7AH,Twickenham,,45320,45320: Retail trade of motor vehicle parts and accessories,45320,tyre
14830209,MTR AUTO TYRES LTD,active,ltd,2023-04-26,"36 Lichfield Street, Walsall, WS1 1TJ, England",WS1 1TJ,Walsall,,45320,45320: Retail trade of motor vehicle parts and accessories,45320,tyre
14833242,SA1 TYRE CENTER LIMITED,active,ltd,2023-04-27,"40 Jones Terrace, Swansea, SA1 6YN, Wales",SA1 6YN,Swansea,,45200; 45310; 45320; 96090,45200: Maintenance and repair of motor vehicles; 45310: Wholesale trade of motor vehicle parts and accessories; 45320: Retail trade of motor vehicle parts and accessories; 96090,45320; 45310,tyre
13354318,GILESEY TYRE AUTOMOTIVES LTD,active,ltd,2021-04-23,"Graham House North Road, Bridgend Industrial Estate, Bridgend, CF31 3TP, Wales",CF31 3TP,Bridgend,,45112; 45200; 45310; 45320,45112; 45200: Maintenance and repair of motor vehicles; 45310: Wholesale trade of motor vehicle parts and accessories; 45320: Retail trade of motor vehicle parts and accessories,45320; 45310,tyre
12395075,AO TYRES LTD,active,ltd,2020-01-09,"C/O Rus & Co, 1192 Stratford Road, Hall Green, Birmingham, B28 8AB, United Kingdom",B28 8AB,Birmingham,,45200; 45320,45200: Maintenance and repair of motor vehicles; 45320: Retail trade of motor vehicle parts and accessories,45320,tyre
11828308,BUZY BEEZ TYRES AND EXHAUSTS LTD,active,ltd,2019-02-15,"131 Rose Hill, Oxford, Oxfordshire, OX4 4HT, England",OX4 4HT,Oxford,Oxfordshire,45320,45320: Retail trade of motor vehicle parts and accessories,45320,tyre
16222384,UNION TYRE RETAIL LTD,active,ltd,2025-01-31,"Unit 1 Oakney Wood Business Units, Oakney Wood Court, Selby, YO8 8FN, England",YO8 8FN,Selby,,45320,45320: Retail trade of motor vehicle parts and accessories,45320,tyre
13756687,LONDON'S MOBILE TYRE FITTING LIMITED,active,ltd,2021-11-22,"6 Unit 8, Free Prae Road, Chertsey, KT16 8EA, England",KT16 8EA,Chertsey,,45320,45320: Retail trade of motor vehicle parts and accessories,45320,tyre
SC836467,MV TYRES LTD,active,ltd,2025-02-04,"Eastend Quarry, Cleghorn, Lanark, ML11 8NR, Scotland",ML11 8NR,Lanark,,45200; 45320,45200: Maintenance and repair of motor vehicles; 45320: Retail trade of motor vehicle parts and accessories,45320,tyre
16233747,HARROW AUTO & TYRES LTD,active,ltd,2025-02-06,"3a Thomson Road, Harrow, HA3 7NA, England",HA3 7NA,Harrow,,45320,45320: Retail trade of motor vehicle parts and accessories,45320,tyre
16233508,PRIMEFLEET TYRES LTD,active,ltd,2025-02-06,"Unit 6 Rosevale Road, Parkhouse Industrial Estate West, Newcastle, ST5 7EF, England",ST5 7EF,Newcastle,,45320,45320: Retail trade of motor vehicle parts and accessories,45320,tyre
14606571,TYRE STATION LTD,active,ltd,2023-01-20,"Unit 2 Manor Street, Bury, BL9 7BL, England",BL9 7BL,Bury,,45320,45320: Retail trade of motor vehicle parts and accessories,45320,tyre
15638015,TYRE HUB (LEIC) LIMITED,active,ltd,2024-04-11,"Unit 22 Temple Building, Temple Road, Leicester, LE5 4JG, England",LE5 4JG,Leicester,,45310; 45320,45310: Wholesale trade of motor vehicle parts and accessories; 45320: Retail trade of motor vehicle parts and accessories,45320; 45310,tyre
16175175,ROTOWHEEL AND TYRE LTD,active,ltd,2025-01-10,"5a Church Road South, Woolton, Liverpool, L25 7RJ, United Kingdom",L25 7RJ,Liverpool,,45320,45320: Retail trade of motor vehicle parts and accessories,45320,tyre
12333601,TYRE LEADER LTD,active,ltd,2019-11-26,"115 Leytonstone Road, London, E15 1JA, England",E15 1JA,London,,45320,45320: Retail trade of motor vehicle parts and accessories,45320,tyre
16178556,TYRES99 TYRE SHOP LTD,active,ltd,2025-01-13,"Land At Tiko Industrial Complex, Murray Street, Stoke-On-Trent, ST6 5QL, United Kingdom",ST6 5QL,Stoke-On-Trent,,45320,45320: Retail trade of motor vehicle parts and accessories,45320,tyre
16182406,TYRES ON THE TYNE LTD,active,ltd,2025-01-14,"19 The Willows, Gateshead, NE10 8BW, United Kingdom",NE10 8BW,Gateshead,,45320,45320: Retail trade of motor vehicle parts and accessories,45320,tyre
16183059,THE TYRE CLINIC EAST YORKSHIRE LTD,active,ltd,2025-01-14,"52 Oxford Street, Hull, HU2 0QP, England",HU2 0QP,Hull,,45320,45320: Retail trade of motor vehicle parts and accessories,45320,tyre
09997515,DIRECT TYRES NW LTD,active,ltd,2016-02-10,"33 Thingwall Road, Irby, Wirral, CH61 3UE, United Kingdom",CH61 3UE,Wirral,,45320,45320: Retail trade of motor vehicle parts and accessories,45320,tyre
13673372,NYUMAH TYRES LTD,active,ltd,2021-10-12,"18 Faraday Road, London, E15 4JT, United Kingdom",E15 4JT,London,,45200; 45310; 45320,45200: Maintenance and repair of motor vehicles; 45310: Wholesale trade of motor vehicle parts and accessories; 45320: Retail trade of motor vehicle parts and accessories,45320; 45310,tyre
11105023,SWANSEA TYRE PLACE LIMITED,active,ltd,2017-12-11,"1333 Neath Road, Swansea, SA1 2LF, Wales",SA1 2LF,Swansea,,45320,45320: Retail trade of motor vehicle parts and accessories,45320,tyre
15948611,TYREVIBE LTD,active,ltd,2024-09-10,"38 Albion Road, Rochdale, OL11 4HQ, England",OL11 4HQ,Rochdale,,45200; 45320; 47910,45200: Maintenance and repair of motor vehicles; 45320: Retail trade of motor vehicle parts and accessories; 47910,45320,tyre
05321011,PHILLIPS TYRES LIMITED,active,ltd,2004-12-23,"Units C & D 24 Peterley Road, Cowley, Oxford, OX4 2TZ, England",OX4 2TZ,Oxford,,45310; 45320,45310: Wholesale trade of motor vehicle parts and accessories; 45320: Retail trade of motor vehicle parts and accessories,45320; 45310,tyre
01093373,SELECTA TYRE LIMITED,active,ltd,1973-01-31,"Micheldever Station, Winchester, Hants, SO21 3AP, England",SO21 3AP,Hants,,45320,45320: Retail trade of motor vehicle parts and accessories,45320,tyre
15316743,COYNE TYRE SERVICES LTD,active,ltd,2023-11-29,"39 Bridge Road, Crosby, Liverpool, L23 6SA, England",L23 6SA,Liverpool,,45320,45320: Retail trade of motor vehicle parts and accessories,45320,tyre
14632480,KINGSTON TYRES LTD,active,ltd,2023-02-01,"27-29 Richmond Road, Kingston, KT2 5BW, England",KT2 5BW,Kingston,,45320,45320: Retail trade of motor vehicle parts and accessories,45320,tyre
15394850,RAJA TYRES LTD,active,ltd,2024-01-08,"Unit 17 New Shires Industrial Estates, 251 Golden Hillock Road, Birmingham, B11 2PJ, United Kingdom",B11 2PJ,Birmingham,,45320,45320: Retail trade of motor vehicle parts and accessories,45320,tyre
14832146,EAGLE TYRES PYLE LTD,active,ltd,2023-04-27,"35 Village Farm Road, Farm Industrial Estate, Pyle, Bridgend, CF33 6LB, United Kingdom",CF33 6LB,Bridgend,,45320,45320: Retail trade of motor vehicle parts and accessories,45320,tyre
15873837,AA TYRE SERVICES LTD,active,ltd,2024-08-03,"128 City Road, London, EC1V 2NX, England",EC1V 2NX,London,,45320,45320: Retail trade of motor vehicle parts and accessories,45320,tyre
14044233,STOCKPORT TYRES LIMITED,active,ltd,2022-04-13,"Unit C, Jones Square, Stockport, Cheshire, SK1 4LJ, United Kingdom",SK1 4LJ,Stockport,Cheshire,45310; 45320,45310: Wholesale trade of motor vehicle parts and accessories; 45320: Retail trade of motor vehicle parts and accessories,45320; 45310,tyre
11483428,PARTS-TRUCK LTD,active,ltd,2018-07-25,"Ealing Cross 1st Floor, 85 Uxbridge Road, London, W5 5TH, United Kingdom",W5 5TH,London,,45111; 45200; 45310; 45320,45111; 45200: Maintenance and repair of motor vehicles; 45310: Wholesale trade of motor vehicle parts and accessories; 45320: Retail trade of motor vehicle parts and accessories,45320; 45310,truck
10404724,AJ TYRES BIRMINGHAM LTD,active,ltd,2016-09-30,"23 Larches Street, Birmingham, West Midlands, B11 1XH, England",B11 1XH,Birmingham,West Midlands,45320,45320: Retail trade of motor vehicle parts and accessories,45320,tyre
13758697,NEW BAYSIDE TYRES LIMITED,active,ltd,2021-11-22,"Unit 3, 1 Watford Road, Cardiff, CF24 1RY, Wales",CF24 1RY,Cardiff,,45320,45320: Retail trade of motor vehicle parts and accessories,45320,tyre
16314977,LN TYRES LTD,active,ltd,2025-03-13,"New England House, 555 Lincoln Road, Peterborough, PE1 2PB, England",PE1 2PB,Peterborough,,45320,45320: Retail trade of motor vehicle parts and accessories,45320,tyre
16317693,SD TYRE SERVICES LIMITED,active,ltd,2025-03-14,"Axis 8 Axis Court Riverside Business Park, Swansea Vale, Swansea, SA7 0AJ, Wales",SA7 0AJ,Swansea,,45320,45320: Retail trade of motor vehicle parts and accessories,45320,tyre
SC838678,SWIFTTREAD MOBILE TYRES LIMITED,active,ltd,2025-02-21,"5 South Charlotte Street, Edinburgh, EH2 4AN, Scotland",EH2 4AN,Edinburgh,,45320,45320: Retail trade of motor vehicle parts and accessories,45320,tyre
16274097,REVOLVE TYRES LTD,active,ltd,2025-02-25,"44 Station Road, Countesthorpe, Leicester, LE8 5TA, England",LE8 5TA,Leicester,,45320,45320: Retail trade of motor vehicle parts and accessories,45320,tyre
06440723,INDEPENDENT TRUCK & TRAILER LTD,active,ltd,2007-11-29,"Eastgate Farm Driffield Lane, Shiptonthorpe, York, YO43 3PP, England",YO43 3PP,York,,45310; 45320,45310: Wholesale trade of motor vehicle parts and accessories; 45320: Retail trade of motor vehicle parts and accessories,45320; 45310,truck
14086740,TYRESTONE LTD,active,ltd,2022-05-04,"133 Tame Road, Birmingham, B6 7DG, England",B6 7DG,Birmingham,,45320,45320: Retail trade of motor vehicle parts and accessories,45320,tyre
16266191,QUALITY CITY TYRES LTD,active,ltd,2025-02-20,"56 Percy Road, Leicester, LE2 8FP, England",LE2 8FP,Leicester,,45310; 45320,45310: Wholesale trade of motor vehicle parts and accessories; 45320: Retail trade of motor vehicle parts and accessories,45320; 45310,tyre
16266776,JR MOBILE TYRE LIMITED,active,ltd,2025-02-20,"41 Fenton House 15 Biscoe Close, Hounslow, TW5 0UP, England",TW5 0UP,Hounslow,,45320,45320: Retail trade of motor vehicle parts and accessories,45320,tyre
16277206,TYRETICK LTD,active,ltd,2025-02-26,"9 Ivy House, Eastbury Road, Watford, WD19 4QH, England",WD19 4QH,Watford,,45320,45320: Retail trade of motor vehicle parts and accessories,45320,tyre
16279482,PARADISE TYRES & MOTORS LTD,active,ltd,2025-02-26,"Unit 26, Rotherwas Industrial Estate, Chapel Road, Hereford, Herefordshire, HR2 6LD, United Kingdom",HR2 6LD,Hereford,Herefordshire,45200; 45320,45200: Maintenance and repair of motor vehicles; 45320: Retail trade of motor vehicle parts and accessories,45320,tyre
16284377,TYRES WAREHOUSE LTD,active,ltd,2025-02-28,"6 Pollen Close, Sale, M33 3LS, England",M33 3LS,Sale,,45320,45320: Retail trade of motor vehicle parts and accessories,45320,tyre
05516732,BRUNEL TYRES LIMITED,active,ltd,2005-07-22,"8 Ashley Hill Trading Estate, St Werburghs, Bristol, BS2 9XS, England",BS2 9XS,Bristol,,45320,45320: Retail trade of motor vehicle parts and accessories,45320,tyre
04154414,AUTOPART (WHEEL & TYRE) LTD.,active,ltd,2001-02-06,"92 Friern Gardens, Wickford, Essex, SS12 0HD, England",SS12 0HD,Wickford,Essex,45320,45320: Retail trade of motor vehicle parts and accessories,45320,tyre
16284568,EVERY TYRE LTD,active,ltd,2025-02-28,"128 City Road, London, EC1V 2NX, United Kingdom",EC1V 2NX,London,,45320,45320: Retail trade of motor vehicle parts and accessories,45320,tyre
16313683,T.D MOBILE TYRE FITTING LTD,active,ltd,2025-03-13,"Flat 42, Alfreda Court, Alfreda Street, London, SW11 5HQ, United Kingdom",SW11 5HQ,London,,45320,45320: Retail trade of motor vehicle parts and accessories,45320,tyre
16320783,SLADE TYRES 300 LIMITED,active,ltd,2025-03-17,"300b Slade Road, Birmingham, B23 7LU, United Kingdom",B23 7LU,Birmingham,,45200; 45320,45200: Maintenance and repair of motor vehicles; 45320: Retail trade of motor vehicle parts and accessories,45320,tyre
15617343,PREMIUM PART WORN TYRES LTD,active,ltd,2024-04-04,"26 Glengall Road, Bexleyheath, DA7 4AL, England",DA7 4AL,Bexleyheath,,45320,45320: Retail trade of motor vehicle parts and accessories,45320,tyre
08016905,TYRETREND LIMITED,active,ltd,2012-04-03,"Tyretrend Railway Road, Rhosddu, Wrexham, Clwyd, LL11 2DH",LL11 2DH,Wrexham,Clwyd,45320,45320: Retail trade of motor vehicle parts and accessories,45320,tyre
15255274,ZAGROS TYRE LTD,active,ltd,2023-11-02,"126-130 Domestic Street, Leeds, LS11 9SG, England",LS11 9SG,Leeds,,45200; 45320,45200: Maintenance and repair of motor vehicles; 45320: Retail trade of motor vehicle parts and accessories,45320,tyre
11653545,FURLONG TYRES LIMITED,active,ltd,2018-11-01,"10 Manor Road, Yeovil, Somerset, BA20 1UQ, England",BA20 1UQ,Yeovil,Somerset,45310; 45320; 45400,45310: Wholesale trade of motor vehicle parts and accessories; 45320: Retail trade of motor vehicle parts and accessories; 45400,45320; 45310,tyre
16062970,HUCKNALL TYRE LTD,active,ltd,2024-11-05,"Former Fire Station, Watnall Road, Nottingham, NG15 6EP, United Kingdom",NG15 6EP,Nottingham,,45320,45320: Retail trade of motor vehicle parts and accessories,45320,tyre
14768281,ENTYRE SUPPLIES LTD,active,ltd,2023-03-30,"Unit 1 Gwel Avon Business Park, Gilston Road, Saltash, Cornwall, PL12 6TW, England",PL12 6TW,Saltash,Cornwall,45320,45320: Retail trade of motor vehicle parts and accessories,45320,tyre
09379779,BARNSTAPLE TYRES LTD,active,ltd,2015-01-08,"Unit 4 Willowtree Court, Roundswell Business Park, Barnstaple, Devon, EX31 3TD",EX31 3TD,Barnstaple,Devon,45320,45320: Retail trade of motor vehicle parts and accessories,45320,tyre
15261798,MOBILE TYRE LEICESTER LIMITED,active,ltd,2023-11-06,"389 Abbey Lane, Leicester, LE4 5QJ, United Kingdom",LE4 5QJ,Leicester,,45320,45320: Retail trade of motor vehicle parts and accessories,45320,tyre
07989146,TYRE ZONE LIMITED,active,ltd,2012-03-13,"Unit 5 6, Willowbank, Claygate Lane Thames Ditton, London, KT7 0LE",KT7 0LE,London,,45320,45320: Retail trade of motor vehicle parts and accessories,45320,tyre
13761106,LIONS-EMERGENCY TYRES LTD,active,ltd,2021-11-23,"130 Sheaveshill Avenue, London, NW9 6RY, England",NW9 6RY,London,,45200; 45320,45200: Maintenance and repair of motor vehicles; 45320: Retail trade of motor vehicle parts and accessories,45320,tyre
13995414,ACE TYRES WAKEFIELD LTD,active,ltd,2022-03-22,"314 Leeds Road, Wakefield, WF1 2HY, England",WF1 2HY,Wakefield,,45320,45320: Retail trade of motor vehicle parts and accessories,45320,tyre
09484944,BEARTOWN TYRES LTD,active,ltd,2015-03-12,"2 The Courtyard, Greenfields Industrial Estate, Congleton, Cheshire, CW12 4TR, United Kingdom",CW12 4TR,Congleton,Cheshire,45320,45320: Retail trade of motor vehicle parts and accessories,45320,tyre
07670001,DC-TYRES DISTRIBUTION LTD,active,ltd,2011-06-14,"Suite 12 2nd Floor Queens House, 180 Tottenham Court Road, London, W1T 7PD",W1T 7PD,London,,45310; 45320,45310: Wholesale trade of motor vehicle parts and accessories; 45320: Retail trade of motor vehicle parts and accessories,45320; 45310,tyre
06914934,GREENAWAYS GARAGE AND TYRES LIMITED,active,ltd,2009-05-26,"Prospect House, 11 Western Road, Launceston, Cornwall, PL15 7AS, England",PL15 7AS,Launceston,Cornwall,45320,45320: Retail trade of motor vehicle parts and accessories,45320,tyre
10577504,SWMC TYRES LTD,active,ltd,2017-01-23,"155 High Street, Aldershot, Hampshire, GU11 1TT, United Kingdom",GU11 1TT,Aldershot,Hampshire,45320,45320: Retail trade of motor vehicle parts and accessories,45320,tyre
02452232,SKI TYRES GLOUCESTER LIMITED,active,ltd,1989-12-13,"Unit 4405 Oakfield Close Tewkesbury Business Park, Tewkesbury, Gloucestershire, GL20 8PF",GL20 8PF,Tewkesbury,Gloucestershire,45200; 45320,45200: Maintenance and repair of motor vehicles; 45320: Retail trade of motor vehicle parts and accessories,45320,tyre
11261015,A2 TRUCK TYRE LIMITED,active,ltd,2018-03-19,"Thames House, Roman Square, Sittingbourne, Kent, ME10 4BJ, United Kingdom",ME10 4BJ,Sittingbourne,Kent,45320,45320: Retail trade of motor vehicle parts and accessories,45320,truck; tyre
15677367,JUNCTION 3 TYRES LTD,active,ltd,2024-04-24,"Unit 4 Swift Lane, Bagshot, GU19 5NJ, England",GU19 5NJ,Bagshot,,45320,45320: Retail trade of motor vehicle parts and accessories,45320,tyre
09204827,DANANO TYRE CLUB LTD,active,ltd,2014-09-05,"42 Barnsdale Crescent, Birmingham, B31 1TD, England",B31 1TD,Birmingham,,45320,45320: Retail trade of motor vehicle parts and accessories,45320,tyre
04974740,MANCHESTER TYRE SERVICES LIMITED,active,ltd,2003-11-24,"108 Wilson Street, Openshaw, Manchester, M11 2AZ, England",M11 2AZ,Manchester,,45320,45320: Retail trade of motor vehicle parts and accessories,45320,tyre
16331789,M11 MOBILE TYRES & REPAIRS LTD,active,ltd,2025-03-20,"55 Bynghams, Harlow, CM19 5NS, England",CM19 5NS,Harlow,,45200; 45320,45200: Maintenance and repair of motor vehicles; 45320: Retail trade of motor vehicle parts and accessories,45320,tyre
16334607,THE RUGBY TYRE COMPANY LTD,active,ltd,2025-03-21,"66 Church Street, Rugby, Warwickshire, CV21 3PT, England",CV21 3PT,Rugby,Warwickshire,45320,45320: Retail trade of motor vehicle parts and accessories,45320,tyre
16349168,FERRY TYRES LTD,active,ltd,2025-03-27,"Northfield House Shurdington Road, Bentham, Cheltenham, Gloucestershire, GL51 4UA, United Kingdom",GL51 4UA,Cheltenham,Gloucestershire,45320,45320: Retail trade of motor vehicle parts and accessories,45320,tyre
15489874,H4 TYRES & WHEELS LIMITED,active,ltd,2024-02-14,"633-637 Lea Bridge Road, London, E10 6AJ, England",E10 6AJ,London,,45200; 45320,45200: Maintenance and repair of motor vehicles; 45320: Retail trade of motor vehicle parts and accessories,45320,tyre
15287952,JIB TYRES TRADING LTD,active,ltd,2023-11-15,"32 Pilton Close, Northampton, Northamptonshire, NN3 5EZ, United Kingdom",NN3 5EZ,Northampton,Northamptonshire,45310; 45320,45310: Wholesale trade of motor vehicle parts and accessories; 45320: Retail trade of motor vehicle parts and accessories,45320; 45310,tyre
16351702,GT TYRES WHOLESALE LTD,active,ltd,2025-03-28,"C/O Cater Pearson Limited 373, High Street North, London, E12 6PG, England",E12 6PG,London,,45310; 45320,45310: Wholesale trade of motor vehicle parts and accessories; 45320: Retail trade of motor vehicle parts and accessories,45320; 45310,tyre
15579114,MOUNT TYRE SERVICES LIMITED,active,ltd,2024-03-20,"Unit 4 Power Station Road, Rugeley, WS15 2HS, United Kingdom",WS15 2HS,Rugeley,,45320,45320: Retail trade of motor vehicle parts and accessories,45320,tyre
13882900,SAFSAH TYRES LTD,active,ltd,2022-01-31,"25 Ruskington Drive, Wigston, LE18 1LB, England",LE18 1LB,Wigston,,45320,45320: Retail trade of motor vehicle parts and accessories,45320,tyre
11159884,FRIENDS TYRES LTD,active,ltd,2018-01-19,"388 Park Road Hockley, Birmingham, West Midlands, B18 5ST, England",B18 5ST,Birmingham,West Midlands,45200; 45320,45200: Maintenance and repair of motor vehicles; 45320: Retail trade of motor vehicle parts and accessories,45320,tyre
16369714,EURO TYRES RAVENSTHORPE LIMITED,active,ltd,2025-04-07,"Unit 3 Ravensbridge Industrial Estate, Bridge Street, Dewsbury, WF13 3EN, England",WF13 3EN,Dewsbury,,45320,45320: Retail trade of motor vehicle parts and accessories,45320,tyre
16378365,K3 TYRES LIMITED,active,ltd,2025-04-10,"11 Celandine Close, Crawley, RH11 9EB, England",RH11 9EB,Crawley,,45320; 47910,45320: Retail trade of motor vehicle parts and accessories; 47910,45320,tyre
07586623,BOWER LANE TYRES LIMITED,active,ltd,2011-03-31,"55 Loudoun Road, St John's Wood, London, NW8 0DL, England",NW8 0DL,St John's Wood,London,45320,45320: Retail trade of motor vehicle parts and accessories,45320,tyre
16400704,YAD WHOLESALE TYRES LIMITED,active,ltd,2025-04-22,"94 Middleton Boulevard, Nottingham, NG8 1AA, England",NG8 1AA,Nottingham,,45320,45320: Retail trade of motor vehicle parts and accessories,45320,tyre
15559789,PREMIER TYRES AND WHEELS LTD,active,ltd,2024-03-13,"17 Pear Tree Drive, Broomhall, Worcester, WR5 2SS, England",WR5 2SS,Worcester,,45320,45320: Retail trade of motor vehicle parts and accessories,45320,tyre
