company_number,company_name,status,company_type,date_of_creation,address,postcode,locality,region,sic_codes,sic_descriptions,matched_sic_codes,keywords_matched
11983460,KLM TYRES LTD,active,ltd,2019-05-08,"76 Wellington Street, Millom, LA18 4DQ, United Kingdom",LA18 4DQ,Millom,,45200,45200: Maintenance and repair of motor vehicles,45200,tyre
04203953,TYLDESLEY TYRE & EXHAUSTS LIMITED,active,ltd,2001-04-23,"Primrose Street, Tyldesley, Greater Manchester, M29 8BQ",M29 8BQ,Greater Manchester,,45200,45200: Maintenance and repair of motor vehicles,45200,tyre
13765407,RA MOBILE TYRES LTD,active,ltd,2021-11-25,"164 Greenside Lane, Droylsden, Manchester, M43 7UR, England",M43 7UR,Manchester,,45200,45200: Maintenance and repair of motor vehicles,45200,tyre
09901667,ELLA TYRES LTD,active,ltd,2015-12-03,"2 Cawley Hatch, Harlow, Essex, CM19 5AN, United Kingdom",CM19 5AN,Harlow,Essex,22110; 45200,22110: Manufacture of rubber tyres and tubes; retreading and rebuilding of rubber tyres; 45200: Maintenance and repair of motor vehicles,45200; 22110,tyre
13822513,MIC BODYWORKS AND TYRES LTD,active,ltd,2021-12-30,"9 River Road, Barking, IG11 0JS, United Kingdom",IG11 0JS,Barking,,45200,45200: Maintenance and repair of motor vehicles,45200,tyre
12427307,FELIXSTOWE TRUCK AND PLANT LTD,active,ltd,2020-01-27,"22 Tower Road, Felixstowe, IP11 7PR, England",IP11 7PR,Felixstowe,,45200,45200: Maintenance and repair of motor vehicles,45200,truck
12416601,TYRE BASE AUTO CENTRE LTD,active,ltd,2020-01-21,"305-317 Wednesbury Road, Walsall, WS2 9QJ, United Kingdom",WS2 9QJ,Walsall,,45200,45200: Maintenance and repair of motor vehicles,45200,tyre
12276334,YORKSHIRE TRUCK REPAIRS LTD,active,ltd,2019-10-23,"24 South Mount, East Keswick, Leeds, LS17 9EY, United Kingdom",LS17 9EY,Leeds,,45200,45200: Maintenance and repair of motor vehicles,45200,truck
12538309,YELLOW TYRES LTD,active,ltd,2020-03-30,"14/2g Docklands Business Centre, 10-16 Tiller Road, London, E14 8PX, England",E14 8PX,London,,45200,45200: Maintenance and repair of motor vehicles,45200,tyre
12704325,CALNE SAVE ON TYRES LTD,active,ltd,2020-06-29,"Unit A, Porte Marsh Road, Calne, SN11 9BW, England",SN11 9BW,Calne,,45200; 45320; 82990,45200: Maintenance and repair of motor vehicles; 45320: Retail trade of motor vehicle parts and accessories; 82990: Other business support service activities n.e.c.,45200; 45320; 82990,tyre
13548574,MOBILE TYRES SURREY LTD,active,ltd,2021-08-04,"41 Oldfields Road, Sutton, Surrey, SM1 2NB, England",SM1 2NB,Sutton,Surrey,45200,45200: Maintenance and repair of motor vehicles,45200,tyre
SC742561,RDPH TYRES LTD,active,ltd,2022-08-26,"Unit 10 Station Road, Buchan Braes, Boddam, AB42 3AR, United Kingdom",AB42 3AR,Boddam,,45200; 45320,45200: Maintenance and repair of motor vehicles; 45320: Retail trade of motor vehicle parts and accessories,45200; 45320,tyre
15731828,LIFESAVERS EMERGENCY TYRES LTD,active,ltd,2024-05-21,"15c Vancouver Road, Edgware, HA8 5DB, England",HA8 5DB,Edgware,,45200,45200: Maintenance and repair of motor vehicles,45200,tyre
04423492,BOBS TYRES LIMITED,active,ltd,2002-04-24,"Blacknell Lane Trading Estate, Crewkerne, Somerset, TA18 7HE",TA18 7HE,Somerset,,45200,45200: Maintenance and repair of motor vehicles,45200,tyre
SC564256,LOCAL TYRE SERVICES LIMITED,active,ltd,2017-04-25,"27 Maitland Street, Helensburgh, G84 7PD, Scotland",G84 7PD,Helensburgh,,45200,45200: Maintenance and repair of motor vehicles,45200,tyre
01514944,COLLIER ROW TYRE SERVICES LIMITED,active,ltd,1980-08-29,"19-20 Bourne Court Southend Road, Woodford Green, Essex, IG8 8HD, United Kingdom",IG8 8HD,Woodford Green,Essex,45200; 45310,45200: Maintenance and repair of motor vehicles; 45310: Wholesale trade of motor vehicle parts and accessories,45200; 45310,tyre
11929390,METRO TYRES OF BOLTON LTD,active,ltd,2019-04-05,"914 Bury Road, Bolton, BL2 6NX, England",BL2 6NX,Bolton,,45200,45200: Maintenance and repair of motor vehicles,45200,tyre
10171594,ACKLAND TYRES LTD,active,ltd,2016-05-10,"Huntworth House, Huntworth, Bridgwater, Somerset, TA7 0AH, England",TA7 0AH,Bridgwater,Somerset,45200,45200: Maintenance and repair of motor vehicles,45200,tyre
08481115,TYRES DIRECT (BEDFORD) LIMITED,active,ltd,2013-04-09,"32 32 High Street, Kempston, Bedford, MK42 7AJ, United Kingdom",MK42 7AJ,Bedford,,45200,45200: Maintenance and repair of motor vehicles,45200,tyre
07366097,RAPID FIT TYRES LTD,active,ltd,2010-09-06,"61 Fairfield Road, West Drayton, West Drayton, Middlesex, UB7 8EZ",UB7 8EZ,West Drayton,Middlesex,45200,45200: Maintenance and repair of motor vehicles,45200,tyre
06552062,HOMETYRE SERVICES ( SHROPSHIRE ) LTD,active,ltd,2008-04-01,"Unit 8 Lower Edgebold Industrial Estate, Lower Edgebold, Shrewsbury, Shropshire, SY5 8NY, England",SY5 8NY,Shrewsbury,Shropshire,45200,45200: Maintenance and repair of motor vehicles,45200,tyre
15720791,MIDLANDS TRUCK & PLANT REPAIRS LTD,active,ltd,2024-05-14,"First Floor, Sterling House, Outrams Wharf, Little Eaton, Derby, DE21 5EL, United Kingdom",DE21 5EL,Little Eaton,Derby,33120; 45200,33120; 45200: Maintenance and repair of motor vehicles,45200,truck
15559636,FAST RESPONSE MOBILE TYRES LTD,active,ltd,2024-03-13,"89 Invito House 1-7 Bramley Crescent, Ilford, IG2 6NU, England",IG2 6NU,Ilford,,45200,45200: Maintenance and repair of motor vehicles,45200,tyre
14424855,MS 1 TYRES UK LTD,active,ltd,2022-10-17,"18 Broadway Parade Coldharbour Lane, Hayes, UB3 3HF, England",UB3 3HF,Hayes,,45200,45200: Maintenance and repair of motor vehicles,45200,tyre
05404856,BRIANT TYRES AND EXHAUSTS LIMITED,active,ltd,2005-03-29,"The Mews Hounds Road, Chipping Sodbury, Bristol, BS37 6EE",BS37 6EE,Bristol,,45200,45200: Maintenance and repair of motor vehicles,45200,tyre
05506546,VARIOUS TRUCK PARTS LIMITED,active,ltd,2005-07-12,"Units 2-4 Beansheaf Industrial Park, Tofts Road, Kirby Misperton, Malton, North Yorkshire, YO17 6BG, England",YO17 6BG,Malton,North Yorkshire,45200; 45310; 45320,45200: Maintenance and repair of motor vehicles; 45310: Wholesale trade of motor vehicle parts and accessories; 45320: Retail trade of motor vehicle parts and accessories,45200; 45320; 45310,truck
08300998,MHB TYRES LIMITED,active,ltd,2012-11-20,"Unit 1 Ward Street, St. Helens, Merseyside, WA10 2RX, England",WA10 2RX,St. Helens,Merseyside,45200,45200: Maintenance and repair of motor vehicles,45200,tyre
10713959,JAKE'S TRUCK SHOP LTD,active,ltd,2017-04-06,"Apple Tree Cottage, 166 Leeds Road, Lofthouse, WF3 3LR, United Kingdom",WF3 3LR,Lofthouse,,45200,45200: Maintenance and repair of motor vehicles,45200,truck
01886381,CITY TYRE SERVICES (CARDIFF) LIMITED,active,ltd,1985-02-15,"476a Cowbridge Road East, Cardiff, CF5 1BL, Wales",CF5 1BL,Cardiff,,45200; 45310,45200: Maintenance and repair of motor vehicles; 45310: Wholesale trade of motor vehicle parts and accessories,45200; 45310,tyre
09600781,MACC TYRES LIMITED,active,ltd,2015-05-20,"89 Brook Street, Macclesfield, Cheshire, SK11 7AW, United Kingdom",SK11 7AW,Macclesfield,Cheshire,45200,45200: Maintenance and repair of motor vehicles,45200,tyre
13224276,MIDTRUCK LTD,active,ltd,2021-02-24,"36 Woodford Way, Wombourne, West Midlands, 36 Woodford Way, Wombourne, West Midlands, WV5 8HD, England",WV5 8HD,Wombourne,West Midlands,45190; 45200; 45320,45190; 45200: Maintenance and repair of motor vehicles; 45320: Retail trade of motor vehicle parts and accessories,45200; 45320,truck
12635410,MOBILE MECHANICS & TYRES LTD,active,ltd,2020-05-30,"Unit 4 Lancaster Road, Barnet, EN4 8BZ, England",EN4 8BZ,Barnet,,45200,45200: Maintenance and repair of motor vehicles,45200,tyre
04527499,COX'S TYRE & EXHAUST SERVICES LTD,active,ltd,2002-09-05,"161-3 Tat Bank Road, Oldbury, Warley, West Midlands, B69 4NH",B69 4NH,Warley,West Midlands,45200,45200: Maintenance and repair of motor vehicles,45200,tyre
13590980,TYRE-EASE LTD,active,ltd,2021-08-28,"The Old Workshop Park Farm Close, Park Farm Industrial Estate, Folkestone, CT19 5DU, England",CT19 5DU,Folkestone,,45200,45200: Maintenance and repair of motor vehicles,45200,tyre
06672439,TRUCKFIX 24\7 LTD,active,ltd,2008-08-13,"9 Castle Court 2 Castlegate Way, Dudley, West Midlands, DY1 4RD",DY1 4RD,Dudley,West Midlands,45200,45200: Maintenance and repair of motor vehicles,45200,truck
10970481,TYLDESLEY TYRES HOLDINGS LIMITED,active,ltd,2017-09-19,"Primrose Street Depot, Primrose St,, Tyldesley, M29 8BQ, United Kingdom",M29 8BQ,Tyldesley,,45200,45200: Maintenance and repair of motor vehicles,45200,tyre
13131675,TYRES SERVICE LIMITED,active,ltd,2021-01-13,"45 Winchester Avenue 45 Winchester Avenue, Leicester, LE3 1AX, England",LE3 1AX,Leicester,,45200,45200: Maintenance and repair of motor vehicles,45200,tyre
06240481,BROMSGROVE TYRE & MOT SERVICES LIMITED,active,ltd,2007-05-09,"Unit 2 Aston Fields Trading Estate, Aston Road, Bromsgrove, Worcestershire, B60 3EX",B60 3EX,Bromsgrove,Worcestershire,45200,45200: Maintenance and repair of motor vehicles,45200,tyre
10814041,MOBILE BRAKES & TYRES LTD,active,ltd,2017-06-12,"Suite 9 Pine Court Business Centre, 36 Gervis Road, Bournemouth, BH1 3DH, England",BH1 3DH,Bournemouth,,45200,45200: Maintenance and repair of motor vehicles,45200,tyre
14146985,JH TRUCKSTYLING LIMITED,active,ltd,2022-06-01,"Brunel House, 1 Archers Court, Huntingdon, Cambridgeshire, PE29 6XG, England",PE29 6XG,Huntingdon,Cambridgeshire,45200,45200: Maintenance and repair of motor vehicles,45200,truck
06920933,ANDOVER TYRE AND AUTO SERVICES LIMITED,active,ltd,2009-06-02,"Unit 1 Crown Way, Walworth Business Park, Andover, Hampshire, SP10 5LU, England",SP10 5LU,Andover,Hampshire,45200,45200: Maintenance and repair of motor vehicles,45200,tyre
09456830,CIRCLE TRUCK & PLANT MAINTENANCE LIMITED,active,ltd,2015-02-24,"Maxwells Chartered Accountants, 4 King Square, Bridgwater, Somerset, TA6 3YF, United Kingdom",TA6 3YF,Bridgwater,Somerset,45200,45200: Maintenance and repair of motor vehicles,45200,truck
14107434,K&G TYRE SERVICES LTD,active,ltd,2022-05-14,"Rear Of 5-6 Lees Parade, Uxbridge Road, Uxbridge, UB10 0PQ, England",UB10 0PQ,Uxbridge,,45112; 45200; 45310; 45320,45112; 45200: Maintenance and repair of motor vehicles; 45310: Wholesale trade of motor vehicle parts and accessories; 45320: Retail trade of motor vehicle parts and accessories,45200; 45320; 45310,tyre
02996482,AUTO TYRE CENTRE LIMITED,active,ltd,1994-11-30,"203 West Street, Fareham, PO16 0EN, England",PO16 0EN,Fareham,,45200,45200: Maintenance and repair of motor vehicles,45200,tyre
13404657,PRONTO TYRES INCE LIMITED,active,ltd,2021-05-17,"Unit 3 Rosebridge Ind Est Anderton Street, Ince, Wigan, WN2 2BG, England",WN2 2BG,Wigan,,45200,45200: Maintenance and repair of motor vehicles,45200,tyre
15725237,SPEEDY 1 TYRES LIMITED,active,ltd,2024-05-16,"69-71 Rochester Road, Cuxton, Rochester, ME2 1AE, England",ME2 1AE,Rochester,,45200,45200: Maintenance and repair of motor vehicles,45200,tyre
07563507,EASY TYRES LIMITED,active,ltd,2011-03-14,"438 Streatham High Road, London, SW16 3PX, England",SW16 3PX,London,,45200,45200: Maintenance and repair of motor vehicles,45200,tyre
07143385,SPEEDYS WHEELS & TYRES (DERBY) LIMITED,active,ltd,2010-02-02,"263 Nottingham Road, Nottingham, NG7 7DA",NG7 7DA,Nottingham,,45200,45200: Maintenance and repair of motor vehicles,45200,tyre
14338291,PROF'S MOBILE TYRES AND SERVICES LTD,active,ltd,2022-09-05,"3 Felton Close, Borehamwood, WD6 4LF, England",WD6 4LF,Borehamwood,,45200,45200: Maintenance and repair of motor vehicles,45200,tyre
14876840,EMERGENCY TYRE REPAIRS LTD,active,ltd,2023-05-17,"97 Judd Street, London, WC1H 9JG, England",WC1H 9JG,London,,33170; 45200,33170: Repair and maintenance of other transport equipment; 45200: Maintenance and repair of motor vehicles,45200; 33170,tyre
03513518,WASHBROOK TYRE AND EXHAUST LTD,active,ltd,1998-02-19,"Washbrook Road, Rushden, Northamptonshire, NN10 6UR",NN10 6UR,Northamptonshire,,45200,45200: Maintenance and repair of motor vehicles,45200,tyre
07553260,A1 TYRES AND EXHAUSTS LTD.,active,ltd,2011-03-07,"Red Hill House, Coventry Road, Coventry, West Midlands, CV7 8DA, United Kingdom",CV7 8DA,Coventry,West Midlands,45200,45200: Maintenance and repair of motor vehicles,45200,tyre
11931377,DADDY TYRES LTD,active,ltd,2019-04-08,"113 Walnut Tree Close, Guildford, GU1 4UQ, England",GU1 4UQ,Guildford,,45200,45200: Maintenance and repair of motor vehicles,45200,tyre
14333885,M1 AUTO AND TYRES LTD,active,ltd,2022-09-02,"2 South Croston Street, Manchester, M16 7WP, England",M16 7WP,Manchester,,45200,45200: Maintenance and repair of motor vehicles,45200,tyre
08012050,JACKSON TYRES LTD,active,ltd,2012-03-29,"C/O Paul Austen Associates Ltd Riverside, Mountbatten Way, Congleton, Cheshire, CW12 1DY, England",CW12 1DY,Congleton,Cheshire,45200,45200: Maintenance and repair of motor vehicles,45200,tyre
03512128,ETS TRUCKS LIMITED,active,ltd,1998-02-17,"6 Witney Road, Nuffield Industrial Estate, Poole, Dorset, BH17 0GH",BH17 0GH,Poole,Dorset,45200,45200: Maintenance and repair of motor vehicles,45200,truck
14896712,TYREMAN HOLDINGS LIMITED,active,ltd,2023-05-26,"5-9 Cherry Street, Warwick, Warwickshire, CV34 4LR, United Kingdom",CV34 4LR,Warwick,Warwickshire,45200,45200: Maintenance and repair of motor vehicles,45200,tyre
08062832,A K W TYRE SERVICES LTD,active,ltd,2012-05-09,"Albert Goodman, Lupin Way, Yeovil, Somerset, BA22 8WW, United Kingdom",BA22 8WW,Yeovil,Somerset,45200,45200: Maintenance and repair of motor vehicles,45200,tyre
05214188,ON SITE TYRES (EATON SOCON) LTD.,active,ltd,2004-08-25,"4b Fenice Court Phoenix Business Park, Eaton Socon, St Neots, Cambs, PE19 8EP",PE19 8EP,St Neots,Cambs,45200,45200: Maintenance and repair of motor vehicles,45200,tyre
01563274,MELTON TYRE AND EXHAUST CENTRE LIMITED,active,ltd,1981-05-21,"Blofield Business Centre Woodbastwick Road, Blofield, Norwich, NR13 4RR, England",NR13 4RR,Norwich,,45200,45200: Maintenance and repair of motor vehicles,45200,tyre
10922129,FORGE MOT & TYRES LTD,active,ltd,2017-08-18,"93 Church Street, Burnley, BB11 2RS, United Kingdom",BB11 2RS,Burnley,,45200,45200: Maintenance and repair of motor vehicles,45200,tyre
06448037,WEETING TYRES LIMITED,active,ltd,2007-12-07,"2920 Trident Court Solihull Parkway, Birmingham Business Park, Birmingham, B37 7YN, United Kingdom",B37 7YN,Birmingham,,45200,45200: Maintenance and repair of motor vehicles,45200,tyre
06906495,MAE INDUSTRIAL TRUCKS LTD,active,ltd,2009-05-15,"34 Orchard Rise, Tibberton, Gloucester, GL19 3AT, England",GL19 3AT,Gloucester,,45200,45200: Maintenance and repair of motor vehicles,45200,truck
04985065,ROBERTS TYRES LIMITED,active,ltd,2003-12-04,"61 Northgate, Sleaford, Lincolnshire, NG34 7BS",NG34 7BS,Lincolnshire,,45200,45200: Maintenance and repair of motor vehicles,45200,tyre
11223685,SUSSEX TYRES LIMITED,active,ltd,2018-02-26,"9 Reynolds Road, Crawley, RH11 7HA, England",RH11 7HA,Crawley,,45200,45200: Maintenance and repair of motor vehicles,45200,tyre
08115214,BRITANNIA TYRES & EXHAUST CENTRE LIMITED,active,ltd,2012-06-21,"C/O Fylde Tax Accountants, 155 Newton Drive, Blackpool, FY3 8LZ, England",FY3 8LZ,Blackpool,,45200,45200: Maintenance and repair of motor vehicles,45200,tyre
13370188,MOBILE TYRE COMPANY (LAXFIELD) LIMITED,active,ltd,2021-04-30,"Potash Farm, Dennington Road, Laxfield, Nr Woodbridge, Suffolk, IP13 8HJ, England",IP13 8HJ,"Laxfield, Nr Woodbridge",Suffolk,45200; 45320,45200: Maintenance and repair of motor vehicles; 45320: Retail trade of motor vehicle parts and accessories,45200; 45320,tyre
12400108,SOMERSET TYRES & SERVICING LTD,active,ltd,2020-01-13,"The Old Pump House, Oborne Road, Sherborne, Dorset, DT9 3RX, United Kingdom",DT9 3RX,Sherborne,Dorset,45200,45200: Maintenance and repair of motor vehicles,45200,tyre
13436520,ASHFORD KENT TYRES LTD,active,ltd,2021-06-03,"Unit 12 ,Tavis House Business Centre Orbital Park, Sevington, Ashford, TN24 0YY, England",TN24 0YY,Ashford,,45200; 45310; 45320,45200: Maintenance and repair of motor vehicles; 45310: Wholesale trade of motor vehicle parts and accessories; 45320: Retail trade of motor vehicle parts and accessories,45200; 45320; 45310,tyre
15775386,E.R.I TRUCK BUS & PLANT LTD,active,ltd,2024-06-12,"75 Eldertree Road, Thorpe Hesley, Rotherham, S61 2TQ, England",S61 2TQ,Rotherham,,45200,45200: Maintenance and repair of motor vehicles,45200,truck
04006561,CITY TYRE EXPERTS LIMITED,active,ltd,2000-06-02,"128-144 Staniforth Road, Shefield, S9 3JQ",S9 3JQ,,,45200,45200: Maintenance and repair of motor vehicles,45200,tyre
11891526,TEIARS LLANGEFNI TYRES LTD,active,ltd,2019-03-19,"7 Lower Brook Street, Oswestry, Shropshire, SY11 2HG, England",SY11 2HG,Oswestry,Shropshire,45200,45200: Maintenance and repair of motor vehicles,45200,tyre
15773890,STOKE TYRE CENTRE LTD,active,ltd,2024-06-12,"Uttoxeter Road, Stoke Tyre Centre, Stoke On Trent, ST3 1PF, England",ST3 1PF,Stoke On Trent,,45200,45200: Maintenance and repair of motor vehicles,45200,tyre
07598412,HI-SPEED TYRES (SOUTH WALES) LIMITED,active,ltd,2011-04-11,"Seaway Parade, Baglan, Port Talbot, SA12 7BR",SA12 7BR,Port Talbot,,45200,45200: Maintenance and repair of motor vehicles,45200,tyre
15776517,SUPREME TYRES LUTON LTD,active,ltd,2024-06-13,"76-78 Bury Park Road, Luton, Bedfordshire, LU1 1HE, United Kingdom",LU1 1HE,Luton,Bedfordshire,45200,45200: Maintenance and repair of motor vehicles,45200,tyre
09636099,HERO TYRE SERVICE LTD,active,ltd,2015-06-12,"White House Farm Town Street, Shiptonthorpe, York, YO43 3PE, England",YO43 3PE,York,,45200,45200: Maintenance and repair of motor vehicles,45200,tyre
15787284,LEIGH BECK TYRES LTD,active,ltd,2024-06-19,"157 High Street, Canvey Island, SS8 7RQ, England",SS8 7RQ,Canvey Island,,45200,45200: Maintenance and repair of motor vehicles,45200,tyre
10945233,FASTYRES LTD,active,ltd,2017-09-04,"85 Gundry Road, Bothenhampton, Bridport, Dorset, DT6 4SE, United Kingdom",DT6 4SE,Bridport,Dorset,45200,45200: Maintenance and repair of motor vehicles,45200,tyre
10969974,A4 MOTOR TYRES LTD,active,ltd,2017-09-19,"357-363 Bath Road, Slough, SL1 6JA, United Kingdom",SL1 6JA,Slough,,45200,45200: Maintenance and repair of motor vehicles,45200,tyre
15787115,TURBO TYRES ESSEX LIMITED,active,ltd,2024-06-18,"33 Wainsfield Villas, Thaxted, Dunmow, CM6 2LS, England",CM6 2LS,Dunmow,,45200,45200: Maintenance and repair of motor vehicles,45200,tyre
13466101,ROGER BARNES TYRES LTD,active,ltd,2021-06-18,"204 Lincoln Road, Skegness, PE25 2PB, England",PE25 2PB,Skegness,,45200,45200: Maintenance and repair of motor vehicles,45200,tyre
SC448079,GWB TYRES LIMITED,active,ltd,2013-04-19,"91 Alexander Street, Airdrie, North Lanarkshire, ML6 0BD",ML6 0BD,Airdrie,North Lanarkshire,45200,45200: Maintenance and repair of motor vehicles,45200,tyre
12052402,SA TYRE SERVICES LTD,active,ltd,2019-06-14,"No. 1 The Hallands Site Thornton Road, Goxhill, Barrow-Upon-Humber, DN19 7LW, England",DN19 7LW,Barrow-Upon-Humber,,45200,45200: Maintenance and repair of motor vehicles,45200,tyre
03999449,TRUCTYRE FLEET MANAGEMENT LIMITED,active,ltd,2000-05-23,"Tructyre House Princesway North, Team Valley, Gateshead, NE11 0NF, England",NE11 0NF,Gateshead,,45200,45200: Maintenance and repair of motor vehicles,45200,tyre
09621538,HANSONS TYRE SERVICES (BRIGG) LTD,active,ltd,2015-06-03,"Unit 1, Island Carr Industrial Estate,, Island Carr Industrial Estate,, Brigg,, Lincolnshire,, DN20 8PD, England",DN20 8PD,"Brigg,","Lincolnshire,",45200,45200: Maintenance and repair of motor vehicles,45200,tyre
08110057,BUS & TRUCK SERVICES LTD,active,ltd,2012-06-19,"3 Judson Avenue, Stapleford, Nottingham, Nottinghamshire, NG9 7FH, United Kingdom",NG9 7FH,Nottingham,Nottinghamshire,45200,45200: Maintenance and repair of motor vehicles,45200,truck
10829059,HIXON TYRES LIMITED,active,ltd,2017-06-21,"Unit 11, Jupiter Business Park The Airfield Estate, Hixon, Stafford, ST18 0PF, United Kingdom",ST18 0PF,Stafford,,45200; 45400,45200: Maintenance and repair of motor vehicles; 45400,45200,tyre
SC251308,DOBY'S TYRE & AUTOCARE LTD.,active,ltd,2003-06-17,"Unit 2-3 Tollpark, Station Road, Buckhaven, Fife, KY8 1JH",KY8 1JH,Buckhaven,Fife,45200,45200: Maintenance and repair of motor vehicles,45200,tyre
05843387,TYRE SPECIALISTS (BAKEWELL) LIMITED,active,ltd,2006-06-12,"85-87 Saltergate, Chesterfield, Derbyshire, S40 1JS",S40 1JS,Derbyshire,,45200,45200: Maintenance and repair of motor vehicles,45200,tyre
04330763,MERCURY GARAGE/WARSOP VALE TYRE SERVICE LIMITED,active,ltd,2001-11-28,"Carter Lane, Warsop Vale, Mansfield, Nottinghamshire, NG20 8XB",NG20 8XB,Mansfield,Nottinghamshire,45200,45200: Maintenance and repair of motor vehicles,45200,tyre
09642060,BURTON TYRE CENTRE LIMITED,active,ltd,2015-06-16,"Unit 1 22 Borough Road, Burton-On-Trent, Staffordshire, DE14 2DA, England",DE14 2DA,Burton-On-Trent,Staffordshire,45200,45200: Maintenance and repair of motor vehicles,45200,tyre
14894023,FALCON TYRES & AUTO LTD,active,ltd,2023-05-25,"27 Ivatt Way, Peterborough, PE3 7PH, England",PE3 7PH,Peterborough,,45200,45200: Maintenance and repair of motor vehicles,45200,tyre
02049560,SCANTRUCK LIMITED,active,ltd,1986-08-26,"C/O Scania (Gb) Ltd, Delaware Drive Tongwell, Milton Keynes, Buckinghamshire, MK15 8HB",MK15 8HB,Milton Keynes,Buckinghamshire,45200,45200: Maintenance and repair of motor vehicles,45200,truck
SC302512,ARMSTRONG TRUCKS LIMITED,active,ltd,2006-05-17,"51 Rae Street, Dumfries, DG1 1JD",DG1 1JD,Dumfries,,45200,45200: Maintenance and repair of motor vehicles,45200,truck
SC631711,G.T. TYRES (FORRES) LTD,active,ltd,2019-05-28,"26-30 Marine Place, Buckie, AB56 1UT, Scotland",AB56 1UT,Buckie,,45200,45200: Maintenance and repair of motor vehicles,45200,tyre
13412242,TRUCK TECH YORKSHIRE LIMITED,active,ltd,2021-05-20,"Goodwood House, Blackbrook Park Avenue, Taunton, Somerset, TA1 2PX, United Kingdom",TA1 2PX,Taunton,Somerset,45200,45200: Maintenance and repair of motor vehicles,45200,truck
SC661263,J K TYRES AND AUTOCENTRE (ALLOA) LIMITED,active,ltd,2020-05-14,"87 Newhouse Road, Grangemouth, FK3 8NJ, Scotland",FK3 8NJ,Grangemouth,,45200,45200: Maintenance and repair of motor vehicles,45200,tyre
06351047,ISE VALLEY TYRES LIMITED,active,ltd,2007-08-23,"3 Wellingborough Road, Little Harrowden, Wellingborough, Northamptonshire, NN9 5BE",NN9 5BE,Wellingborough,Northamptonshire,45200,45200: Maintenance and repair of motor vehicles,45200,tyre
05745716,ELDON TYRES LIMITED,active,ltd,2006-03-16,"Suite 3, 108b Newgate Street, Bishop Auckland, DL14 7EQ, England",DL14 7EQ,Bishop Auckland,,45200,45200: Maintenance and repair of motor vehicles,45200,tyre
13412599,MD TRUCK AND AGRICULTURAL LIMITED,active,ltd,2021-05-21,"Broadacres The Ridge,, Woodfalls, Salisbury, SP5 2LQ, United Kingdom",SP5 2LQ,Salisbury,,45200,45200: Maintenance and repair of motor vehicles,45200,truck
03507901,TRUCK & PLANT ENGINEERING LIMITED,active,ltd,1998-02-11,"6 Moor Business Park, Ellough Road, Beccles, Suffolk, NR34 7TQ, United Kingdom",NR34 7TQ,Beccles,Suffolk,45200,45200: Maintenance and repair of motor vehicles,45200,truck
13669154,SEFTON TYRES LTD,active,ltd,2021-10-08,"Landmark House, 43-45, Merton Road, Merseyside, Liverpool, L20 7AP, England",L20 7AP,"Merseyside, Liverpool",,45200; 45320,45200: Maintenance and repair of motor vehicles; 45320: Retail trade of motor vehicle parts and accessories,45200; 45320,tyre
10201640,JADA TYRES LTD,active,ltd,2016-05-26,"Unit 1 Bank Street Bamford Street, Manchester, M11 4FE, England",M11 4FE,Manchester,,45200,45200: Maintenance and repair of motor vehicles,45200,tyre
02516771,ELITE TRUCK & TRAILER REPAIRS LTD,active,ltd,1990-06-29,"Elite House Swinbourne Road, Burnt Mills Industrial Estate, Basildon, Essex, SS13 1EF",SS13 1EF,Basildon,Essex,45200,45200: Maintenance and repair of motor vehicles,45200,truck
11357215,24/7 NEW AND PART WORN TYRES LTD,active,ltd,2018-05-11,"8 Suez Street, Warrington, WA1 1EG",WA1 1EG,Warrington,,45200; 45320; 45400,45200: Maintenance and repair of motor vehicles; 45320: Retail trade of motor vehicle parts and accessories; 45400,45200; 45320,tyre
11812997,MANCHESTER MOBILE TYRE SERVICE LTD,active,ltd,2019-02-07,"731 Stockport Road Stockport Road, Manchester, M19 3AR, England",M19 3AR,Manchester,,45200,45200: Maintenance and repair of motor vehicles,45200,tyre
15752086,CROWMARSH TYRES LIMITED,active,ltd,2024-05-31,"50 Hithercroft Road, Wallingford, Uk, OX10 9DG, United Kingdom",OX10 9DG,Wallingford,Uk,45200,45200: Maintenance and repair of motor vehicles,45200,tyre
10343867,NTC TRUCK AND TRAILER SERVICES LIMITED,active,ltd,2016-08-24,"28 Greencroft Road, Consett, DH8 7DY, United Kingdom",DH8 7DY,Consett,,45200,45200: Maintenance and repair of motor vehicles,45200,truck
11498702,HAMPTON TYRES & MOT LTD,active,ltd,2018-08-03,"5-9 Thames Street, Hampton, TW12 2EW, England",TW12 2EW,Hampton,,45200,45200: Maintenance and repair of motor vehicles,45200,tyre
09399479,TRADE PRICE TYRES LIMITED,active,ltd,2015-01-21,"Unit 1 Albany Trading Estate, Albany Street, Newport, Gwent, NP20 5NQ, United Kingdom",NP20 5NQ,Newport,Gwent,45200,45200: Maintenance and repair of motor vehicles,45200,tyre
04409477,WALLS TRUCK SERVICES LIMITED,active,ltd,2002-04-04,"Elfed House Oak Tree Court, Mulberry Drive, Cardiff Gate Business Park, Cardiff, CF23 8RS",CF23 8RS,Cardiff Gate Business Park,Cardiff,45112; 45200,45112; 45200: Maintenance and repair of motor vehicles,45200,truck
12818507,AGILITY TYRES AND AUTOS LTD,active,ltd,2020-08-17,"19 Roman Way, Bourne End, SL8 5LR, England",SL8 5LR,Bourne End,,45200,45200: Maintenance and repair of motor vehicles,45200,tyre
02925048,FAST FIT TYRE & EXHAUST SYSTEMS LIMITED,active,ltd,1994-05-03,"147a High Street, Waltham Cross, Hertfordshire, EN8 7AP, England",EN8 7AP,Waltham Cross,Hertfordshire,45200,45200: Maintenance and repair of motor vehicles,45200,tyre
